Description,StockCode,UnitPrice,Country
white hanging heart t-light holder,85123A,2.55,United Kingdom
white metal lantern,71053,3.39,United Kingdom
cream cupid hearts coat hanger,84406B,2.75,United Kingdom
knitted union flag hot water bottle,84029G,3.39,United Kingdom
red woolly hottie white heart.,84029E,3.39,United Kingdom
set 7 babushka nesting boxes,22752,7.65,United Kingdom
glass star frosted t-light holder,21730,4.25,United Kingdom
hand warmer union jack,22633,1.85,United Kingdom
hand warmer red polka dot,22632,1.85,United Kingdom
assorted colour bird ornament,84879,1.69,United Kingdom
poppy's playhouse bedroom ,22745,2.1,United Kingdom
poppy's playhouse kitchen,22748,2.1,United Kingdom
feltcraft princess charlotte doll,22749,3.75,United Kingdom
ivory knitted mug cosy ,22310,1.65,United Kingdom
box of 6 assorted colour teaspoons,84969,4.25,United Kingdom
box of vintage jigsaw blocks ,22623,4.95,United Kingdom
box of vintage alphabet blocks,22622,9.95,United Kingdom
home building block word,21754,5.95,United Kingdom
love building block word,21755,5.95,United Kingdom
recipe box with metal heart,21777,7.95,United Kingdom
doormat new england,48187,7.95,United Kingdom
jam making set with jars,22960,4.25,United Kingdom
red coat rack paris fashion,22913,4.95,United Kingdom
yellow coat rack paris fashion,22912,4.95,United Kingdom
blue coat rack paris fashion,22914,4.95,United Kingdom
bath building block word,21756,5.95,United Kingdom
alarm clock bakelike pink,22728,3.75,France
alarm clock bakelike red ,22727,3.75,France
alarm clock bakelike green,22726,3.75,France
panda and bunnies sticker sheet,21724,0.85,France
stars gift tape ,21883,0.65,France
inflatable political globe ,10002,0.85,France
vintage heads and tails card game ,21791,1.25,France
set/2 red retrospot tea towels ,21035,2.95,France
round snack boxes set of4 woodland ,22326,2.95,France
spaceboy lunch box ,22629,1.95,France
lunch box i love london,22659,1.95,France
circus parade lunch box ,22631,1.95,France
charlotte bag dolly girl design,22661,0.85,France
red toadstool led night light,21731,1.65,France
 set 2 tea towels i love london ,22900,2.95,France
vintage seaside jigsaw puzzles,21913,3.75,France
mini jigsaw circus parade ,22540,0.42,France
mini jigsaw spaceboy,22544,0.42,France
mini paint set vintage ,22492,0.65,France
postage,POST,18.0,France
paper chain kit 50's christmas ,22086,2.55,United Kingdom
edwardian parasol red,20679,4.95,United Kingdom
retro coffee mugs assorted,37370,1.06,United Kingdom
save the planet mug,21871,1.06,United Kingdom
vintage billboard drink me mug,21071,1.06,United Kingdom
vintage billboard love/hate mug,21068,1.06,United Kingdom
wood 2 drawer cabinet white finish,82483,4.95,United Kingdom
wood s/3 cabinet ant white finish,82486,6.95,United Kingdom
wooden picture frame white finish,82482,2.1,United Kingdom
wooden frame antique white ,82494L,2.55,United Kingdom
victorian sewing box large,21258,10.95,United Kingdom
hot water bottle tea and sympathy,22114,3.45,United Kingdom
red hanging heart t-light holder,21733,2.55,United Kingdom
jumbo bag pink polkadot,22386,1.95,United Kingdom
jumbo  bag baroque black white,85099C,1.95,United Kingdom
jumbo bag charlie and lola toys,21033,2.95,United Kingdom
strawberry charlotte bag,20723,0.85,United Kingdom
red 3 piece retrospot cutlery set,84997B,3.75,United Kingdom
blue 3 piece polkadot cutlery set,84997C,3.75,United Kingdom
set/6 red spotty paper plates,21094,0.85,United Kingdom
lunch bag red retrospot,20725,1.65,United Kingdom
strawberry lunch box with cutlery,21559,2.55,United Kingdom
lunch box with cutlery retrospot ,22352,2.55,United Kingdom
pack of 72 retrospot cake cases,21212,0.42,United Kingdom
pack of 60 dinosaur cake cases,21975,0.55,United Kingdom
pack of 60 pink paisley cake cases,21977,0.55,United Kingdom
60 teatime fairy cake cases,84991,0.55,United Kingdom
tomato charlie+lola coaster set,84519A,2.95,United Kingdom
charlie & lola wastepaper bin flora,85183B,1.25,United Kingdom
red charlie+lola personal doorsign,85071B,0.38,United Kingdom
jumbo storage bag suki,21931,1.95,United Kingdom
jumbo bag pink vintage paisley,21929,1.95,United Kingdom
jam making set printed,22961,1.45,United Kingdom
retrospot tea set ceramic 11 pc ,22139,4.25,United Kingdom
girly pink tool set,84854,4.95,United Kingdom
jumbo shopper vintage red paisley,22411,1.95,United Kingdom
"airline lounge,metal sign",82567,2.1,United Kingdom
white spot red ceramic drawer knob,21672,1.25,United Kingdom
red drawer knob acrylic edwardian,22774,1.25,United Kingdom
clear drawer knob acrylic edwardian,22771,1.25,United Kingdom
photo clip line,71270,1.25,United Kingdom
felt egg cosy chicken,22262,0.85,United Kingdom
piggy bank retrospot ,22637,2.55,United Kingdom
skull shoulder bag,21934,1.65,United Kingdom
you're confusing me metal sign ,21169,1.69,United Kingdom
cook with wine metal sign ,21166,1.95,United Kingdom
gin + tonic diet metal sign,21175,2.1,United Kingdom
yellow breakfast cup and saucer,37444A,2.95,United Kingdom
pink breakfast cup and saucer ,37444C,2.95,United Kingdom
paper chain kit retrospot,22083,2.95,United Kingdom
small heart flowers hook ,84971S,0.85,United Kingdom
tea time des tea cosy,47580,2.55,United Kingdom
felt egg cosy white rabbit ,22261,0.85,United Kingdom
zinc willie winkie  candle stick,84832,0.85,United Kingdom
ceramic cherry cake money bank,22644,1.45,United Kingdom
retrospot large milk jug,21533,4.95,United Kingdom
set of 6 funky beakers,21557,2.95,United Kingdom
edwardian parasol black,15056BL,5.95,United Kingdom
edwardian parasol natural,15056N,5.95,United Kingdom
ceramic strawberry cake money bank,22646,1.45,United Kingdom
blue owl soft toy,22176,2.95,United Kingdom
balloon art make your own flowers,22438,1.95,United Kingdom
glass cloche small,22778,3.95,United Kingdom
gumball monochrome coat rack,22719,1.06,United Kingdom
doormat fancy font home sweet home,21523,6.75,United Kingdom
vintage snakes & ladders,21912,3.75,United Kingdom
chocolate calculator,21832,1.65,United Kingdom
recycling bag retrospot ,22379,2.1,United Kingdom
toy tidy pink polkadot,22381,1.85,United Kingdom
antique glass dressing table pot,22798,2.95,United Kingdom
ivory giant garden thermometer,22926,5.95,United Kingdom
3 tier cake tin green and cream,22839,14.95,United Kingdom
3 tier cake tin red and cream,22838,14.95,United Kingdom
set 3 wicker oval baskets w lids,22783,16.95,United Kingdom
wood black board ant white finish,82484,6.45,United Kingdom
colour glass t-light holder hanging,84755,0.65,United Kingdom
hanging metal heart lantern,22464,1.65,United Kingdom
hanging medina lantern small,21324,2.95,United Kingdom
natural slate heart chalkboard ,22457,2.95,United Kingdom
heart of wicker small,22469,1.45,United Kingdom
heart of wicker large,22470,2.55,United Kingdom
white lovebird lantern,22224,2.95,United Kingdom
classic metal birdcage plant holder,21340,12.75,United Kingdom
cream heart card holder,22189,3.95,United Kingdom
enamel flower jug cream,22427,5.95,United Kingdom
enamel fire bucket cream,22428,6.95,United Kingdom
enamel bread bin cream,22424,10.95,United Kingdom
jumbo bag dolly girl design,22663,1.95,United Kingdom
traditional christmas ribbons,85049A,1.25,United Kingdom
organiser wood antique white ,22168,8.5,United Kingdom
lunch bag dolly girl design,22662,1.65,United Kingdom
white wire egg holder,84880,4.95,United Kingdom
jumbo bag red retrospot,85099B,1.65,United Kingdom
chilli lights,79321,3.82,United Kingdom
light garland butterfiles pink,22780,3.37,United Kingdom
wooden owls light garland ,22779,3.37,United Kingdom
fairy tale cottage nightlight,22466,1.45,United Kingdom
home small wood letters,21363,4.95,United Kingdom
gingham heart  doorstop red,21411,4.25,United Kingdom
five heart hanging decoration,22318,2.95,United Kingdom
assorted bottle top  magnets ,22915,0.42,United Kingdom
fridge magnets us diner assorted,22922,0.85,United Kingdom
homemade jam scented candles,22969,1.45,United Kingdom
fridge magnets les enfants assorted,22923,0.85,United Kingdom
rose caravan doorstop,21115,6.75,United Kingdom
5 hook hanger magic toadstool,22242,1.65,United Kingdom
christmas lights 10 reindeer,22941,8.5,Australia
vintage union jack cushion cover,21622,4.95,Australia
set of 3 coloured  flying ducks,35004C,5.45,Australia
set of 3 gold flying ducks,35004G,6.35,Australia
red retrospot umbrella,85014B,5.95,Australia
black/blue polkadot umbrella,85014A,5.95,Australia
red diner wall clock,22193,8.5,Australia
blue diner wall clock,22192,8.5,Australia
ivory diner wall clock,22191,8.5,Australia
large heart measuring spoons,22195,1.65,Australia
small heart measuring spoons,22196,0.85,Australia
jam jar with pink lid,22962,0.72,United Kingdom
jam jar with green lid,22963,0.72,United Kingdom
rose cottage keepsake box ,22968,8.5,United Kingdom
hanging heart zinc t-light holder,84970S,0.64,United Kingdom
paper chain kit vintage christmas,22910,2.55,United Kingdom
disco ball christmas decoration,20668,0.1,United Kingdom
small popcorn holder,22197,0.72,United Kingdom
large popcorn holder ,22198,1.45,United Kingdom
set/20 red retrospot paper napkins ,21080,0.64,United Kingdom
set/6 red spotty paper cups,21086,0.65,United Kingdom
polkadot rain hat ,21786,0.32,United Kingdom
deluxe sewing kit ,22654,4.95,United Kingdom
retrospot heart hot water bottle,21485,4.25,United Kingdom
english rose hot water bottle,84030E,3.75,United Kingdom
photo cube,22174,1.48,United Kingdom
3 stripey mice feltcraft,22150,1.95,United Kingdom
set of 6 soldier skittles,22619,3.75,United Kingdom
traditional wooden skipping rope,21891,1.25,United Kingdom
wooden box of dominoes,21889,1.25,United Kingdom
rustic  seventeen drawer sideboard,22827,165.0,United Kingdom
party cones carnival assorted,22127,1.25,United Kingdom
party cones candy assorted,22128,1.25,United Kingdom
picnic basket wicker small,22502,5.95,United Kingdom
star decoration painted zinc ,22338,0.65,United Kingdom
retrospot lamp,22180,9.95,United Kingdom
"fancy font birthday card, ",21506,0.42,United Kingdom
hand warmer scotty dog design,22866,1.85,United Kingdom
hand warmer owl design,22865,1.85,United Kingdom
hand warmer red retrospot,22632,1.85,United Kingdom
dog bowl chasing ball design,22349,3.75,United Kingdom
clothes pegs retrospot pack 24 ,22558,1.25,United Kingdom
hand over the chocolate   sign ,85152,2.1,United Kingdom
travel sewing kit,22652,1.65,United Kingdom
black heart card holder,22188,3.95,United Kingdom
chick grey hot water bottle,21484,3.45,United Kingdom
small glass heart trinket pot,21314,2.1,United Kingdom
alarm clock bakelike ivory,22730,3.75,United Kingdom
alarm clock bakelike orange,22729,3.75,United Kingdom
hand warmer bird design,22867,2.1,United Kingdom
ivory embroidered quilt ,22803,35.75,United Kingdom
set of 3 black flying ducks,35004B,4.65,United Kingdom
pack of 12 red retrospot tissues ,21980,0.29,United Kingdom
red retrospot mug,21844,2.95,United Kingdom
babushka lights string of 10,22468,6.75,United Kingdom
doormat fairy cake,48185,7.95,United Kingdom
strawberry ceramic trinket box,21232,1.25,United Kingdom
pink doughnut trinket pot ,22064,1.65,United Kingdom
silk purse babushka pink,22449,3.35,United Kingdom
hot water bottle i am so poorly,22835,4.65,United Kingdom
chocolate hot water bottle,22112,4.95,United Kingdom
white skull hot water bottle ,21479,3.75,United Kingdom
scottie dog hot water bottle,22111,4.95,United Kingdom
bird house hot water bottle,22110,2.55,United Kingdom
boudoir square tissue box,22098,1.25,United Kingdom
skulls square tissue box,22100,1.25,United Kingdom
photo frame cornice,22766,2.95,United Kingdom
silk purse babushka red,22451,3.35,United Kingdom
picture dominoes,22549,1.45,United Kingdom
s/6 sew on crochet flowers,84744,1.25,United Kingdom
scandinavian reds ribbons,85049E,1.25,United Kingdom
balloons  writing set ,21328,1.65,United Kingdom
lavender incense in tin,17091A,1.25,United Kingdom
tv dinner tray vintage paisley,22473,4.95,United Kingdom
set of 4 english rose placemats,84509A,3.75,United Kingdom
set of 4 english rose coasters,84510A,1.25,United Kingdom
triple photo frame cornice ,22767,9.95,United Kingdom
family photo frame cornice,22768,9.95,United Kingdom
mirrored disco ball ,21463,5.95,United Kingdom
disco ball rotator battery operated,21464,4.25,United Kingdom
silver looking mirror,20820,4.95,United Kingdom
ladies & gentlemen metal sign,85150,2.55,United Kingdom
metal sign her dinner is served ,22117,2.95,United Kingdom
doormat topiary,48129,7.95,United Kingdom
bathroom metal sign,82580,0.55,United Kingdom
kitchen metal sign,82578,0.55,United Kingdom
toilet metal sign,82581,0.55,United Kingdom
metal sign take it or leave it ,22413,2.95,United Kingdom
i'm on holiday metal sign,21907,2.1,United Kingdom
grow your own basil in enamel mug,22441,2.1,United Kingdom
set/10 pink polkadot party candles,21122,1.25,United Kingdom
set 20 napkins fairy cakes design ,22851,0.85,United Kingdom
set of 6 t-lights snowmen,22810,2.95,United Kingdom
set of 6 t-lights santa,22809,2.95,United Kingdom
set of 9 heart shaped balloons,22435,1.25,United Kingdom
sandwich bath sponge,20966,1.25,United Kingdom
apple bath sponge,20963,1.25,United Kingdom
strawberry bath sponge ,20961,1.25,United Kingdom
black pirate treasure chest,22068,1.65,United Kingdom
star portable table light ,21743,2.95,United Kingdom
snowflake portable table light ,21744,2.95,United Kingdom
pink oval jewelled mirror,84709B,5.95,United Kingdom
retrospot cigar box matches ,21592,1.25,United Kingdom
cosy hour giant tube matches,21587,2.55,United Kingdom
jazz hearts purse notebook,20992,0.85,United Kingdom
candleholder pink hanging heart,22804,2.95,United Kingdom
assorted colour mini cases,20749,7.95,United Kingdom
lunch bag spaceboy design ,22382,1.65,United Kingdom
lunch bag woodland,20726,1.65,United Kingdom
lunch bag pink polkadot,22384,1.65,United Kingdom
gumball coat rack,22467,2.55,United Kingdom
blue new baroque candlestick candle,84625C,2.95,United Kingdom
pink new baroquecandlestick candle,84625A,2.95,United Kingdom
fairy cake flannel assorted colour,21108,2.55,United Kingdom
bread bin diner style pink,22848,16.95,United Kingdom
tea time table cloth,47570B,10.65,United Kingdom
hot water bottle babushka ,22837,4.25,United Kingdom
heart ivory trellis small,22297,1.25,United Kingdom
pink drawer knob acrylic edwardian,22772,1.25,United Kingdom
green drawer knob acrylic edwardian,22773,1.25,United Kingdom
blue drawer knob acrylic edwardian,22805,1.25,United Kingdom
set 6 football celebration candles,21125,1.25,United Kingdom
set of 6 girls celebration candles,21126,1.25,United Kingdom
romantic pinks ribbons ,85049C,1.25,United Kingdom
bright blues ribbons ,85049D,1.25,United Kingdom
chocolate box ribbons ,85049G,1.25,United Kingdom
party invites football,21061,0.85,United Kingdom
party invites jazz hearts,21063,0.85,United Kingdom
party invites spaceman,21062,0.85,United Kingdom
set of 3 butterfly cookie cutters,84380,1.25,United Kingdom
set of 3 heart cookie cutters,84378,1.25,United Kingdom
3 piece spaceboy cookie cutter set,22964,2.1,United Kingdom
pack of 72 skull cake cases,21213,0.55,United Kingdom
pack of 60 spaceboy cake cases,22417,0.55,United Kingdom
72 sweetheart fairy cake cases,84992,0.55,United Kingdom
lunch bag suki  design ,22383,1.65,United Kingdom
lunch bag cars blue,20728,1.65,United Kingdom
lunch bag  black skull.,20727,1.65,United Kingdom
heart ivory trellis large,22296,1.65,United Kingdom
set/5 red retrospot lid glass bowls,20914,2.55,United Kingdom
magic drawing slate dinosaur,22537,0.42,United Kingdom
magic drawing slate bake a cake ,22533,0.42,United Kingdom
12 pencils tall tube skulls,20982,0.85,United Kingdom
red  harmonica in box ,21915,1.25,United Kingdom
blue harmonica in box ,21914,1.25,United Kingdom
skulls  water transfer tattoos ,21544,0.85,United Kingdom
pack 3 boxes bird pannetone ,22813,1.95,United Kingdom
set of 20 kids cookie cutters,84375,2.1,United Kingdom
10 colour spaceboy pen,22418,0.85,United Kingdom
victorian glass hanging t-light,22178,1.25,United Kingdom
single heart zinc t-light holder,84970L,0.95,United Kingdom
hanging metal star lantern,22465,1.65,United Kingdom
silver hanging t-light holder,84949,1.65,United Kingdom
doormat red retrospot,20685,7.95,United Kingdom
doormat hearts,48194,7.95,United Kingdom
natural slate rectangle chalkboard,22488,1.65,United Kingdom
lovebird hanging decoration white ,22219,0.85,United Kingdom
pens assorted funny face,22610,0.85,United Kingdom
card circus parade,22716,0.42,United Kingdom
wrap cowboys  ,22706,0.42,United Kingdom
airline bag vintage tokyo 78,22371,4.25,United Kingdom
set of 72 retrospot paper  doilies,21210,1.45,United Kingdom
plasters in tin skulls,22553,1.65,United Kingdom
sleeping cat erasers,16237,0.21,United Kingdom
card birthday cowboy,22714,0.42,United Kingdom
pack 3 boxes christmas pannetone,22812,1.95,United Kingdom
rotating silver angels t-light hldr,84347,2.55,United Kingdom
ribbon reel making snowmen ,22736,1.65,United Kingdom
4 traditional spinning tops,22620,1.25,United Kingdom
bag 500g swirly marbles,21705,1.65,United Kingdom
5 strand glass necklace crystal,90199C,6.35,United Kingdom
squarecushion cover pink union flag,22785,6.75,United Kingdom
spaceboy childrens egg cup,22975,1.25,United Kingdom
children's spaceboy mug,22972,1.65,United Kingdom
feltcraft cushion owl,22568,3.75,United Kingdom
black candelabra t-light holder,85116,2.1,United Kingdom
toy tidy dolly girl design,22664,2.1,United Kingdom
set 12 lavender  botanical t-lights,21609,2.95,United Kingdom
union jack flag luggage tag,21866,1.25,United Kingdom
red heart luggage tag,20669,1.25,United Kingdom
red glass tassle bag charm,90129F,2.95,United Kingdom
clear acrylic faceted bangle,90210B,2.95,United Kingdom
doormat union jack guns and roses,21955,7.95,United Kingdom
vanilla scent candle jewelled box,72802C,4.25,United Kingdom
full english breakfast plate,22109,3.75,United Kingdom
magic drawing slate circus parade  ,22531,0.42,United Kingdom
christmas hanging heart with bell,21811,1.25,United Kingdom
cake stand victorian filigree med,22183,6.75,United Kingdom
paisley pattern  stickers,21678,0.85,United Kingdom
flowers  stickers,21676,0.85,United Kingdom
black love bird candle,85169B,1.25,United Kingdom
party time pencil erasers,16238,0.21,United Kingdom
pink b'fly c/cover w bobbles,84906,5.95,United Kingdom
pink union jack  luggage tag,21867,1.25,United Kingdom
6 ribbons elegant christmas ,22075,1.65,United Kingdom
aged glass silver t-light holder,21326,0.65,United Kingdom
boom box speaker girls,21065,5.95,United Kingdom
6 ribbons shimmering pinks ,22074,1.65,United Kingdom
jumbo bag owls,20713,1.95,United Kingdom
owl doorstop,21116,4.95,United Kingdom
painted metal star with holly bells,21824,1.45,United Kingdom
painted metal heart with holly bell,21823,1.45,United Kingdom
angel decoration stars on dress,22153,0.42,United Kingdom
jumbo bag strawberry,85099F,1.95,United Kingdom
strawberry shopper bag,20717,1.25,United Kingdom
round snack boxes set of 4 fruits ,22328,2.95,United Kingdom
round snack boxes set of 4 skulls,22327,2.95,United Kingdom
dolly girl lunch box,22630,1.95,United Kingdom
green polkadot plate ,21245,1.69,United Kingdom
blue polkadot plate ,21244,1.69,United Kingdom
red retrospot plate ,21242,1.69,United Kingdom
pink  polkadot plate ,21243,1.69,United Kingdom
feltcraft doll molly,22273,2.95,United Kingdom
feltcraft christmas fairy,22940,4.25,United Kingdom
set of 3 notebooks in parcel,22759,1.65,United Kingdom
red retrospot tape,21880,0.65,United Kingdom
cosy slipper shoes small  red ,21738,2.95,United Kingdom
6 ribbons rustic charm,22077,1.65,United Kingdom
12 daisy pegs in wood box,21448,1.65,United Kingdom
5 hook hanger red magic toadstool,22243,1.65,United Kingdom
christmas craft tree top angel,22141,2.1,United Kingdom
christmas craft little friends,22144,2.1,United Kingdom
cosy slipper shoes small green,21739,2.95,United Kingdom
feltcraft doll rosie,22271,2.95,United Kingdom
feltcraft doll emily,22274,2.95,United Kingdom
feltcraft princess olivia doll,22751,3.75,United Kingdom
rex cash+carry jumbo shopper,21034,0.95,United Kingdom
feltcraft cushion rabbit,22570,3.75,United Kingdom
feltcraft cushion butterfly,22569,3.75,United Kingdom
tote bag i love london,22902,2.1,United Kingdom
folding umbrella pinkwhite polkadot,21710,4.95,United Kingdom
folding umbrella cream polkadot,21708,4.95,United Kingdom
folding umbrella white/red polkadot,21711,4.95,United Kingdom
set 10 lights night owl,22179,6.75,United Kingdom
folding umbrella red/white polkadot,21706,4.95,United Kingdom
s/4 valentine decoupage heart box,85184C,2.95,United Kingdom
soldiers egg cup ,22988,1.25,United Kingdom
red retrospot mini cases,20750,7.95,United Kingdom
60 cake cases vintage christmas,22952,0.55,United Kingdom
ribbon reel christmas sock bauble,22739,1.65,United Kingdom
ribbon reel snowy village,22738,1.65,United Kingdom
set of 20 vintage christmas napkins,22909,0.85,United Kingdom
turquoise christmas tree ,35591T,1.25,United Kingdom
red star card holder,22186,2.95,United Kingdom
wicker wreath small,22695,1.45,United Kingdom
advent calendar gingham sack,22580,5.95,United Kingdom
feltcraft butterfly hearts,22147,1.45,United Kingdom
party cone christmas decoration ,22130,0.85,United Kingdom
wicker star ,22694,2.1,United Kingdom
vintage snap cards,21790,0.85,United Kingdom
feltcraft 6 flower friends,22149,2.1,United Kingdom
bird decoration red retrospot,22321,0.85,United Kingdom
christmas gingham tree,22594,0.85,United Kingdom
christmas gingham star,22593,0.85,United Kingdom
christmas gingham heart,22595,0.85,United Kingdom
pack of 12 pink polkadot tissues,21986,0.29,United Kingdom
feltcraft princess lola doll,22750,3.75,United Kingdom
pack of 12 london tissues ,22616,0.29,United Kingdom
purple drawerknob acrylic edwardian,22775,1.25,United Kingdom
children's apron dolly girl ,22899,2.1,United Kingdom
childrens apron spaceboy design,22367,1.95,United Kingdom
christmas lights 10 santas ,22942,8.5,United Kingdom
pack of 60 mushroom cake cases,21976,0.55,United Kingdom
60 cake cases dolly girl design,22951,0.55,United Kingdom
hand warmer babushka design,22834,2.1,United Kingdom
set 12 retro white chalk sticks,21916,0.42,United Kingdom
feltcraft hairband red and blue,22587,0.85,United Kingdom
feltcraft hairband pink and purple,22566,0.85,United Kingdom
feltcraft hairbands pink and white ,22565,0.85,United Kingdom
tv dinner tray dolly girl,22472,4.95,United Kingdom
plasters in tin vintage paisley ,22557,1.65,United Kingdom
plasters in tin spaceboy,22551,1.65,United Kingdom
plasters in tin woodland animals,22554,1.65,United Kingdom
magic drawing slate spaceboy ,22534,0.42,United Kingdom
magic drawing slate go to the fair ,22529,0.42,United Kingdom
magic drawing slate dolly girl ,22530,0.42,United Kingdom
charlie + lola red hot water bottle,84032B,2.95,United Kingdom
urban black ribbons ,85049H,1.25,United Kingdom
set of 6 t-lights toadstools,22807,2.95,United Kingdom
rotating leaves t-light holder,21494,1.25,United Kingdom
cupcake lace paper set 6,22938,1.95,United Kingdom
traditional wooden catch cup game ,21892,1.25,United Kingdom
s/6 wooden skittles in cotton bag,21890,2.95,United Kingdom
red metal beach spade ,21718,1.25,United Kingdom
boys vintage tin seaside bucket,21716,2.55,United Kingdom
girls vintage tin seaside bucket,21715,2.55,United Kingdom
grey heart hot water bottle,22113,3.75,United Kingdom
kings choice tea caddy ,22358,2.95,United Kingdom
kings choice biscuit tin,22357,4.25,United Kingdom
metal sign empire tea,22115,2.95,United Kingdom
fawn blue hot water bottle,21481,2.95,United Kingdom
pack of 6 birdy gift tags,22585,1.25,United Kingdom
ceramic strawberry money box,21556,2.55,United Kingdom
ceramic heart fairy cake money bank,22645,1.45,United Kingdom
ceramic pirate chest money bank,22650,1.45,United Kingdom
doorstop retrospot heart,22508,3.75,United Kingdom
retrospot babushka doorstop,22511,3.75,United Kingdom
sweetheart wire wall tidy,22829,9.95,United Kingdom
red retrospot oven glove ,21154,1.06,United Kingdom
namaste swagat incense,17021,0.24,United Kingdom
ceramic strawberry design mug,22059,1.25,United Kingdom
classical rose small vase,84678,1.25,United Kingdom
hyacinth bulb t-light candles,85172,0.42,United Kingdom
christmas craft white fairy ,22142,1.45,United Kingdom
cosy hour cigar box matches ,21591,1.25,United Kingdom
red tea towel classic design,22480,1.25,United Kingdom
heart filigree dove  small,22294,1.25,United Kingdom
retrospot childrens apron,21156,1.95,United Kingdom
colouring pencils brown tube,10133,0.85,United Kingdom
4 ivory dinner candles silver flock,72800E,2.55,United Kingdom
zinc metal heart decoration,84836,1.25,United Kingdom
green fern notebook,20774,1.65,United Kingdom
blue paisley notebook,20773,1.65,United Kingdom
chrysanthemum notebook,20777,1.65,United Kingdom
large chinese style scissor,16016,0.85,United Kingdom
small chinese style scissor,16014,0.42,United Kingdom
hanging glass etched tealight,21651,1.65,United Kingdom
cooking set retrospot,22618,9.95,United Kingdom
kings choice giant tube matches,21586,2.55,United Kingdom
place setting white star,22152,0.42,United Kingdom
s/15 silver glass baubles in bag,84754,1.25,United Kingdom
french wc sign blue metal,22670,1.25,United Kingdom
fairy soap soap holder,84849B,1.69,United Kingdom
green giant garden thermometer,22927,5.95,United Kingdom
blue giant garden thermometer,22925,5.95,United Kingdom
victorian sewing box small ,21259,5.95,United Kingdom
victorian sewing box medium,21257,7.95,United Kingdom
set/10 red polkadot party candles,21121,1.25,United Kingdom
washroom metal sign,82552,1.45,United Kingdom
black sweetheart bracelet,90200B,4.25,United Kingdom
diamante hair grip pack/2 black dia,90059B,1.65,United Kingdom
black diamante expandable ring,90185C,4.25,United Kingdom
diamante hair grip pack/2 ruby,90059E,1.65,United Kingdom
