Description,StockCode,UnitPrice,Country
regency mirror with shutters,22828,165.0,United Kingdom
vintage kitchen print seafood,21281,2.55,United Kingdom
cardholder gingham christmas tree,22591,2.55,United Kingdom
pink cat bowl,22703,2.1,United Kingdom
small medina stamped metal bowl ,21684,0.85,United Kingdom
fawn and mushroom greeting card,84247L,0.42,United Kingdom
baking mould chocolate cup cakes,22937,2.55,United Kingdom
set/6 eau de nil bird t-lights,85170C,2.1,United Kingdom
childs garden rake blue,22516,2.1,United Kingdom
childs garden fork pink,22523,0.85,United Kingdom
childs garden trowel pink,22521,0.85,United Kingdom
pink regency teacup and saucer,22698,2.95,United Kingdom
french enamel candleholder,85053,2.1,United Kingdom
green square compact mirror,84875B,3.75,United Kingdom
blue heart compact mirror,84876D,3.75,United Kingdom
jet black las vegas necklace 45cm,90211B,5.95,United Kingdom
assorted colour metal cat ,84192,1.25,United Kingdom
triangular pouffe vintage ,21628,14.95,Channel Islands
felt toadstool large,22254,1.25,United Kingdom
chalkboard kitchen organiser,22769,21.95,EIRE
4 lavender botanical dinner candles,21615,3.75,United Kingdom
cake stand 3 tier magic garden,22236,10.95,United Kingdom
baking mould easter egg milk choc,22933,2.95,United Kingdom
doormat merry christmas red ,22689,7.95,United Kingdom
cut glass t-light holder octagon,85107,2.55,United Kingdom
funky diva pen,22741,0.85,United Kingdom
ribbons purse ,21051,2.1,United Kingdom
set/4 spring flower decoration,21382,2.95,United Kingdom
assorted circular mobile,44234,0.21,United Kingdom
ass col circle mobile ,44235,0.42,United Kingdom
metal tube chime on bamboo,75131,1.69,United Kingdom
"flower glass garland neckl.36""black",90036D,7.95,United Kingdom
medium chinese style scissor,16015,0.5,United Kingdom
small folding scissor(pointed edge),16008,0.25,United Kingdom
blue breakfast cup and saucer ,37444B,2.95,United Kingdom
"retro ""tea for one"" ",37333,4.95,United Kingdom
garden path notebook ,20778,1.65,United Kingdom
abstract circles pocket book,20758,0.85,United Kingdom
s/4 ivory mini rose candle in bowl,85039B,1.65,United Kingdom
set/4 blue flower candles in bowl,85040B,1.65,United Kingdom
red retrospot small milk jug,21535,2.55,United Kingdom
hairclips forties fabric assorted,22319,0.65,France
retrospot candle  small,21284,1.69,United Kingdom
3 tier sweetheart garden shelf,22824,35.95,United Kingdom
fairy dreams incense ,17084N,0.21,United Kingdom
dragons blood incense,17084P,0.21,United Kingdom
gold fishing gnome,21128,6.95,United Kingdom
silver standing gnome   ,21132,4.25,United Kingdom
danish rose photo frame,84818,2.55,Spain
hearts gift tape,21879,0.65,Spain
set of 3 coney island oval boxes,85008,4.95,United Kingdom
mint green rose towel,84913B,4.65,United Kingdom
soft pink rose towel ,84913A,4.65,United Kingdom
hand towel pink flower and daisy,84915,5.95,United Kingdom
white soap rack with 2 bottles,84843,5.95,United Kingdom
romantic images gift wrap set,85032A,2.1,United Kingdom
curious images gift wrap set,85032C,2.1,United Kingdom
vintage bead pink purse ,35648,2.95,United Kingdom
tea time tea set in gift box,37501,6.95,United Kingdom
pompom curtain,84356,6.95,United Kingdom
set of 6 ribbons vintage christmas,22734,2.55,United Kingdom
english rose small scented flower,47578A,0.85,United Kingdom
french blue metal door sign 4,22679,1.25,United Kingdom
set of 36 doilies spaceboy design ,22416,1.45,United Kingdom
hawaiian grass skirt ,21562,1.25,United Kingdom
hen house w chick standing,84228,0.42,Germany
assorted easter decorations  bells,22856,1.25,Germany
baking mould easter egg white choc,22934,2.95,Germany
set/4 colourful mixing bowls,37475,9.95,United Kingdom
set of 4 pistachio lovebird coaster,84951A,2.55,United Kingdom
set of 4 black lovebird coasters,84951B,2.55,United Kingdom
tea cosy blue stripe,22308,2.55,United Kingdom
empire design rosette,22053,1.25,United Kingdom
doormat welcome to our home,22692,7.95,United Kingdom
gold standing gnome,21131,3.75,United Kingdom
first class luggage tag ,20654,1.25,United Kingdom
ass col large sand frog p'weight,17165D,1.05,United Kingdom
green birdhouse decoration,21442,0.72,United Kingdom
hanging chick cream decoration,22291,1.45,United Kingdom
blue polkadot garden parasol,15058A,7.95,United Kingdom
silver fabric mirror,20868,1.25,United Kingdom
white honeycomb paper garland ,21189,1.65,United Kingdom
danish rose trinket trays,84820,5.95,United Kingdom
set 4 nursery des round boxes,85006,2.95,United Kingdom
danish rose deluxe coaster,84821,0.85,United Kingdom
small kitchen flower pots plaque,84638,6.95,United Kingdom
kitchen flower pots wall plaque,84637,5.95,United Kingdom
bunny wooden painted with flower ,22229,0.85,United Kingdom
kitty pencil erasers,16236,0.21,United Kingdom
bunny wooden painted with bird ,22228,0.85,United Kingdom
wrap green russian folkart ,16169P,0.42,United Kingdom
lily brooch olive colour,90081C,4.95,United Kingdom
popart rect pencil sharpener asst,16054,0.42,United Kingdom
large tortilla design red bowl,84595E,3.75,United Kingdom
yellow metal chicken heart ,84459B,1.49,United Kingdom
blue knitted hen ,35915B,1.65,United Kingdom
candy spot heart decoration,85086A,0.85,United Kingdom
picnic boxes set of 3 retrospot ,22628,4.95,United Kingdom
bottle bag retrospot ,22377,2.1,United Kingdom
green goose feather christmas tree ,21261,16.95,United Kingdom
holly top christmas stocking,85084,0.85,United Kingdom
flower purple clock w/sucker,81950V,0.85,United Kingdom
skulls design flannel,21942,0.85,United Kingdom
origami rose incense/candle set ,17012D,2.55,EIRE
origami jasmine incense/candle set,17012B,2.55,EIRE
origami opium incense/candle set ,17012E,2.55,EIRE
origami sandlewood incense/cand set,17012F,2.55,EIRE
tall rococo candle holder,84609,8.5,EIRE
mini cake stand  hanging strawbery,22055,1.45,United Kingdom
fruit tree and birds wall plaque,84631,7.95,United Kingdom
sprig lavender artificial flower,84799,0.42,United Kingdom
set of 3 pink flying ducks,35004P,5.45,United Kingdom
painted pink rabbit ,21454,0.85,United Kingdom
frying pan blue polkadot,22201,4.25,United Kingdom
pink polkadot garden parasol,15058B,7.95,United Kingdom
enchanted bird plant cage,84789,3.75,United Kingdom
paperweight vintage collage,22393,2.55,United Kingdom
paperweight home sweet home,22391,2.55,United Kingdom
strawbry scented votive candle,85230E,0.29,United Kingdom
love seat antique white metal,22826,175.0,United Kingdom
dog bowl vintage cream,22852,4.25,United Kingdom
mirror mosaic goblet candle holder,22105,4.25,United Kingdom
mirror mosaic t-light holder ,22102,1.65,United Kingdom
rattle snake eggs,16225,1.25,United Kingdom
mini highlighter pens,16033,0.12,United Kingdom
silver photo frame,20830,2.1,United Kingdom
gold photo frame,20831,2.1,United Kingdom
lipstick pen baby pink,22420,0.42,United Kingdom
kittens design flannel,21944,0.85,United Kingdom
french blue metal door sign 2,22677,1.25,United Kingdom
set of 4 polkadot placemats ,84509C,3.75,United Kingdom
crystal hoop earring floral leaf,90186B,2.95,United Kingdom
silver/amethyst drop earrings leaf,90190C,2.95,United Kingdom
crystal pair heart hair slides,90003D,3.75,United Kingdom
midnight blue pair heart hair slide,90003C,3.75,United Kingdom
pink vintage victorian earrings,90067A,2.95,United Kingdom
rose colour pair heart hair slides,90003B,3.75,United Kingdom
retrospot candle  medium,21285,2.1,United Kingdom
small tall camphor wood toadstool,21378,1.65,United Kingdom
blossom images gift wrap set,85032B,2.1,Japan
assorted easter gift tags,22857,0.85,Japan
envelope 50 blossom images,85017B,0.85,Japan
easter tin keepsake,22858,1.65,Japan
easter tin chicks in garden,22861,1.65,Japan
jigsaw tree with watering can,22230,0.85,Japan
jigsaw toadstools 3 piece,22232,1.65,Japan
easter tin bucket,21717,2.1,Japan
blue tiled tray,20793,6.75,United Kingdom
assorted laquered incense holders,17096,0.17,United Kingdom
cartoon  pencil sharpeners,16218,0.16,United Kingdom
tropical holiday purse ,20664,2.95,United Kingdom
carousel ponies baby bib,47593A,1.25,United Kingdom
vip holiday purse,20670,2.95,United Kingdom
cakes and rabbits design flannel ,21943,0.85,United Kingdom
party time design flannel,21946,0.85,United Kingdom
economy holiday purse,20666,2.95,United Kingdom
old doc russel metal sign,82605,2.1,United Kingdom
ninja rabbit pink,21027,1.25,United Kingdom
blue shark helicopter,85136B,7.95,United Kingdom
green wire standing candle holder,84882,3.75,United Kingdom
romantic images scrap book set,85031A,4.95,United Kingdom
mini jigsaw purdey,22546,0.42,United Kingdom
letter shape pencil sharpener,16216,0.16,United Kingdom
black stitched wall clock,84660B,1.25,United Kingdom
door hanger  mum + dads room,21248,1.45,United Kingdom
queen of the skies holiday purse ,20663,2.95,United Kingdom
gold scroll glass t-light holder,21736,2.1,United Kingdom
glass jar marmalade ,22363,2.95,United Kingdom
pink butterfly washbag,84922,4.25,United Kingdom
s/4 pink flower candles in bowl,85040A,1.65,United Kingdom
"flower glass garld neckl36""amethyst",90036E,7.95,United Kingdom
purple boudicca large bracelet,90160A,6.95,United Kingdom
red boudicca large bracelet,90160B,6.95,United Kingdom
ant copper turq boudicca bracelet,90161B,4.95,United Kingdom
turq+red boudicca large bracelet,90160C,6.95,United Kingdom
pink boudicca large bracelet,90160D,6.95,United Kingdom
"bathroom scales, tropical beach",82011A,3.75,United Kingdom
large pink glass sundae dish,20801,0.75,United Kingdom
charlie & lola wastepaper bin blue,85183A,3.75,United Kingdom
black christmas flock droplet ,35610B,1.25,United Kingdom
white christmas flock droplet ,35610C,1.25,United Kingdom
flowers tile hook,84927E,2.1,United Kingdom
danish rose bedside cabinet,84816,39.95,United Kingdom
cake stand victorian filigree large,22184,8.5,United Kingdom
pink glass tassle bag charm ,90129A,2.95,United Kingdom
white murano twist bracelet,90120D,4.25,United Kingdom
doorstop racing car design,22512,1.25,United Kingdom
black silouette candle plate,72780,0.85,United Kingdom
4 vanilla botanical candles,21619,3.75,United Kingdom
hen party cordon barrier tape,22954,1.25,United Kingdom
vintage union jack shopping bag,22611,4.95,United Kingdom
french kitchen sign blue metal,22675,1.25,United Kingdom
empire gift wrap,22047,0.42,United Kingdom
candle plate lace white,22214,2.55,United Kingdom
ant silver fuschia boudicca ring,90162C,2.95,United Kingdom
pink/white glass demi choker,90078,7.5,United Kingdom
gold m pearl  orbit necklace,90014B,9.95,United Kingdom
chunky silver necklace pastel flowe,90147,9.95,United Kingdom
ivory shell heart necklace,90032,6.25,United Kingdom
moroccan beaten metal dish large,21331,12.75,United Kingdom
zinc heart lattice t-light holder,20846,1.25,United Kingdom
ridged glass t-light holder,21666,0.65,United Kingdom
zinc heart lattice charger large,20847,3.75,United Kingdom
zinc heart lattice charger small,20848,2.95,United Kingdom
silver aperitif glass,20826,2.12,United Kingdom
antique glass place setting,21145,1.25,United Kingdom
set of 6 herb tins sketchbook,22723,3.95,United Kingdom
set of 6 spice tins pantry design,22722,3.95,United Kingdom
set of 3 cake tins pantry design ,22720,4.95,United Kingdom
pink dog cannister,84575A,5.95,United Kingdom
orange tv tray table ,84313C,4.25,United Kingdom
blue tv tray table ,84313B,4.25,United Kingdom
purple bertie glass bead bag charm,90125D,2.1,United Kingdom
sweetheart cream steel table rect,21473,19.95,United Kingdom
grey acrylic faceted bangle,90210A,1.25,United Kingdom
mr robot soft toy,20704,1.95,United Kingdom
large cake towel chocolate spots,21109,1.95,United Kingdom
danish rose folding chair,84823,7.95,United Kingdom
pink love bird candle,85169D,0.42,United Kingdom
diamante ring assorted in box.,90057,1.25,United Kingdom
red   acrylic faceted bangle,90210C,1.25,United Kingdom
purple acrylic faceted bangle,90210D,1.25,United Kingdom
vintage blue kitchen cabinet,22656,125.0,United Kingdom
small pink glass sundae dish,20803,0.42,United Kingdom
home garland painted zinc ,22342,0.85,United Kingdom
set 3 wicker storage baskets ,22782,9.95,United Kingdom
silver rococo candle stick,84766,1.95,United Kingdom
red victorian fabric oval box,35095B,0.42,United Kingdom
number tile vintage font 8,22887,1.95,United Kingdom
number tile vintage font 5,22884,1.95,United Kingdom
danish rose decorative plate,84817,0.42,United Kingdom
wake up cockerel tile hook,84927A,2.1,United Kingdom
baking mould toffee cup  chocolate,22932,2.55,United Kingdom
baking mould cupcake chocolate,22937,2.55,United Kingdom
set of 3 cake tins sketchbook,22721,4.95,United Kingdom
vippassport cover ,20622,2.1,United Kingdom
vintage bead pink scarf ,35651,1.65,United Kingdom
white hand towel with butterfly,84917,1.25,United Kingdom
wrap circus parade,22711,0.42,United Kingdom
childs garden fork blue ,22522,0.85,United Kingdom
childs garden trowel blue ,22520,0.85,United Kingdom
happy easter hanging decoration,22270,3.75,Cyprus
hanging heart basket,85195,2.1,Cyprus
3d hearts  honeycomb paper garland,21188,2.95,Cyprus
hanging spring flower egg large,85194L,0.85,Cyprus
white stitched wall clock,84660A,1.25,United Kingdom
set of 4 carousel placemats ,84509E,1.25,United Kingdom
asstd col butterfly/crystal w/chime,75178,0.42,United Kingdom
blue daisy mobile,75011,0.85,United Kingdom
ass floral print multi screwdriver,47503A,0.42,United Kingdom
number tile vintage font no ,22889,0.75,United Kingdom
number tile vintage font 9 ,22888,0.42,United Kingdom
number tile vintage font 7,22886,0.42,United Kingdom
number tile vintage font 6 ,22885,0.42,United Kingdom
number tile vintage font 4,22883,0.42,United Kingdom
number tile vintage font 3,22882,0.42,United Kingdom
number tile vintage font 2,22881,0.42,United Kingdom
number tile vintage font 1,22880,0.42,United Kingdom
number tile vintage font 0,22879,0.42,United Kingdom
ceramic love heart money bank,22647,0.42,United Kingdom
pens assorted spaceball,22609,0.21,United Kingdom
pens assorted funky jeweled ,22608,0.21,United Kingdom
vintage pink decorative parasol,21632,3.95,United Kingdom
hippy chic decorative parasol,21631,3.95,United Kingdom
mrs robot soft toy,20705,1.95,United Kingdom
pink bertie glass bead bag charm,90125A,0.85,United Kingdom
pink hearts light chain ,85180B,1.25,United Kingdom
red hearts light chain ,85180A,1.25,United Kingdom
set/6 frog prince t-light candles,85173,0.85,United Kingdom
"white tea,coffee,sugar jars",85159B,1.25,United Kingdom
pink stitched wall clock,84660C,1.25,United Kingdom
jam jar with blue lid,22963,0.72,United Kingdom
glass chalice green  small ,21319,1.45,United Kingdom
blue pot plant candle ,20931,3.75,United Kingdom
frosted white base ,79403,0.85,United Kingdom
multicolour honeycomb paper garland,21200,1.65,United Kingdom
milk pan blue polkadot,22204,3.75,United Kingdom
crystal stud earrings assorted col ,90058B,0.38,United Kingdom
retro brown ball ashtray ,84597B,1.25,United Kingdom
beach hut design blackboard,84688,4.25,United Kingdom
first class passport cover ,20617,2.1,United Kingdom
turq ice cream bum bag ,62094B,2.55,United Kingdom
silver roccoco chandelier,84616,29.95,United Kingdom
pink fly swat,84673A,0.65,United Kingdom
blue fly swat,84673B,0.65,United Kingdom
large red retrospot windmill,21749,2.1,United Kingdom
origami rose incense in tube,17013D,1.65,United Kingdom
metal sign cupcake single hook,82613D,0.42,United Kingdom
ivory hanging decoration  egg,21386,0.85,United Kingdom
vintage red mug,21066,1.25,United Kingdom
cake plate lovebird pink,22223,1.95,United Kingdom
amber diamante expandable ring,90185A,4.25,United Kingdom
fine silver necklace w pastel flowe,90146,7.5,United Kingdom
ant copper pink boudicca bracelet,90161D,4.95,United Kingdom
ant copper lime boudicca bracelet,90161C,4.95,United Kingdom
green glass tassle bag charm,90129C,2.95,United Kingdom
turquoise glass tassle bag charm ,90129B,2.95,United Kingdom
egg cup natural chicken,22269,1.25,United Kingdom
set/4 red mini rose candle in bowl,85039A,1.65,United Kingdom
felt farm animal sheep,22257,0.42,United Kingdom
felt farm animal rabbit,22258,0.42,United Kingdom
felt farm animal hen,22259,0.42,United Kingdom
pink christmas flock droplet ,35610A,1.25,United Kingdom
"acrylic jewel snowflake,pink",35817P,2.55,United Kingdom
jardin etched glass fruitbowl,85141,10.75,United Kingdom
ridged glass posy vase ,21656,1.45,United Kingdom
black christmas tree 120cm,35599B,8.49,United Kingdom
freshwater pearl bracelet gold,90042A,2.55,United Kingdom
pale pink/amethyst stone necklace,90136,9.95,United Kingdom
fire polished glass neckl gold,90060B,5.95,United Kingdom
"pearl & shell 42""neckl. green",90035A,10.75,United Kingdom
teal/fuschia col bead necklace,90133,4.95,United Kingdom
amber fine bead necklace w tassel,90179A,5.95,United Kingdom
pink flock glass candleholder,79329,1.65,United Kingdom
jardin etched glass small bell jar,85146,4.95,United Kingdom
botanical rose greeting card,22033,0.42,United Kingdom
botanical lily greeting card,22032,0.42,United Kingdom
black medium glass cake stand,84751B,3.75,United Kingdom
stripes design monkey doll,84507B,2.55,United Kingdom
s/4 groovy cat magnets,85211,1.65,United Kingdom
blue gingham rose cushion cover,84620,5.95,United Kingdom
ping! microwave plate,22108,3.75,United Kingdom
mini painted garden decoration ,85212,0.21,United Kingdom
asstd fruit+flowers fridge magnets,84929,0.55,United Kingdom
origami lavender incense/candl set ,17012C,2.55,United Kingdom
pink  honeycomb paper fan,21194,2.1,United Kingdom
classic french style basket green ,21792,6.75,United Kingdom
folding umbrella blackblue polkadot,21707,4.95,United Kingdom
origami vanilla incense cones,17014A,0.5,United Kingdom
origami vanilla incense/candle set ,17012A,0.5,United Kingdom
number tile cottage garden 0 ,22868,1.95,United Kingdom
number tile cottage garden 9,22877,1.95,United Kingdom
number tile cottage garden no,22878,2.1,United Kingdom
number tile cottage garden 6,22874,1.95,United Kingdom
number tile cottage garden 2,22870,1.95,United Kingdom
number tile cottage garden 7,22875,1.95,United Kingdom
number tile cottage garden 5,22873,1.95,United Kingdom
number tile cottage garden 4,22872,1.95,United Kingdom
number tile cottage garden 1,22869,1.95,United Kingdom
number tile cottage garden 3 ,22871,1.95,United Kingdom
coffee mug pears  design,22302,2.55,United Kingdom
scotties design washbag,47594B,1.95,France
round white confetti in tube,21196,1.65,United Kingdom
pink  heart confetti in tube,21199,1.65,United Kingdom
cake stand lace white,22218,4.25,United Kingdom
london bus coffee mug,22970,2.55,United Kingdom
pink enamel+glass hair comb,90209C,2.1,United Kingdom
coffee mug apples design,22303,2.55,United Kingdom
ceramic bowl with love heart design,22062,2.95,United Kingdom
botanical rose gift wrap,22040,0.42,United Kingdom
pink spots chocolate nesting boxes ,21348,2.55,United Kingdom
queens guard coffee mug,22971,2.55,United Kingdom
green round compact mirror,84877B,1.25,United Kingdom
set/4 white retro storage cubes ,84078A,34.95,United Kingdom
psychedelic tile coaster,84926F,0.42,United Kingdom
red pudding spoon,21400,0.42,United Kingdom
multicolour rabbit egg warmer,35911A,2.1,United Kingdom
curious images scrap book set,85031C,4.95,United Kingdom
magic sheep wool growing from paper,84012,2.55,United Kingdom
set of 4 diamond napkin rings,84813,12.75,United Kingdom
pink new baroque flock candlestick,84613A,4.65,United Kingdom
silver hoop earrings with flower,90145,5.95,United Kingdom
silver lariat black stone earrings,90194,4.25,United Kingdom
apron modern vintage cotton,21043,5.95,United Kingdom
paperweight vintage paisley,22395,0.85,United Kingdom
polkadot coffee cup & saucer pink,37342,0.85,United Kingdom
eau de nil love bird candle,85169C,1.25,United Kingdom
black small glass cake stand,84750B,1.95,United Kingdom
skulls storage box large,21425,2.95,United Kingdom
paperweight kings choice ,22394,0.85,United Kingdom
felt egg cosy ladybird ,22263,0.19,United Kingdom
house shape pencil sharpener,16219,0.21,United Kingdom
vintage kitchen print fruits,21279,2.55,United Kingdom
teatime round pencil sharpener ,16048,0.42,United Kingdom
mobile vintage hearts ,22325,4.95,United Kingdom
french lavender scent heart,21391,2.1,United Kingdom
4 pink dinner candle silver flock,72800C,2.55,United Kingdom
origami sandlewood incense+flower,17011F,2.1,United Kingdom
enamel pink tea container,35809A,2.1,United Kingdom
enamel pink coffee container,35810A,2.1,United Kingdom
tropical passport cover ,20619,0.75,United Kingdom
sunflower decorative parasol,21633,3.95,United Kingdom
pink fluffy christmas decoration,35607A,0.19,United Kingdom
money box housekeeping design,22410,1.25,United Kingdom
ivory hanging decoration  bird,21389,0.85,United Kingdom
silver disco handbag,84859A,5.95,United Kingdom
silver t-light setting,85103,6.75,United Kingdom
blossom images scrap book set,85031B,4.95,United Kingdom
retrospot candle  large,21286,2.55,United Kingdom
decoration white chick magic garden,22249,0.85,United Kingdom
money box first ade design,22407,1.25,United Kingdom
pink gingham cat with scarf,84584,2.55,Portugal
floral soft car toy,20696,3.75,Portugal
pink chick egg warmer + egg cup,35914,2.1,United Kingdom
blue  tile hook,20794,2.55,United Kingdom
pink felt easter rabbit garland,85205B,2.55,Germany
school desk and chair ,22929,65.0,EIRE
white baroque wall clock ,85163A,12.75,United Kingdom
black baroque wall clock ,85163B,12.75,United Kingdom
set/3 polkadot stacking tins,85232A,4.95,United Kingdom
tea cosy red  stripe,22309,2.55,United Kingdom
woodland storage box large ,21424,2.95,Germany
cake stand lovebird 2 tier pink,22221,9.95,Germany
polyester filler pad 30cmx30cm,46000U,1.25,Belgium
mock lobster fridge magnet,21698,0.85,United Kingdom
wooden box advent calendar ,35400,8.95,United Kingdom
drop diamante earrings purple,90177D,2.95,United Kingdom
ant copper red boudicca bracelet,90161A,4.95,United Kingdom
drop diamante earrings black diamon,90177B,2.95,United Kingdom
vintage rose bead bracelet raspberr,90198A,4.25,United Kingdom
lazer cut necklace w pastel beads,90154,8.95,United Kingdom
5 strand glass necklace amber,90199D,6.35,United Kingdom
silver/mop orbit necklace,90014A,9.95,United Kingdom
daisy hair band,90170,1.65,United Kingdom
purple chunky glass+bead necklace,90178B,11.95,United Kingdom
summer daisies bag charm,90114,2.55,United Kingdom
classic french style basket brown,21793,6.75,United Kingdom
eau de nile jewelled photoframe,85023B,2.55,United Kingdom
pink boudoir t-light holder,85109,0.85,United Kingdom
cream delphinium artificial flower,84804A,2.95,United Kingdom
large white/pink rose art flower,84800L,2.12,United Kingdom
medium white/pink rose art flower,84800M,1.69,United Kingdom
white anemone artificial flower,84802A,1.69,United Kingdom
pink candystuft artificial flower,84806A,1.45,United Kingdom
pink baby bunting,22668,2.95,United Kingdom
"decoration , wobbly rabbit , metal ",22286,1.65,United Kingdom
frog candle,20941,1.25,United Kingdom
wrap monster fun ,22707,0.42,United Kingdom
toybox  wrap ,21503,0.42,United Kingdom
blue blossom hair clip,90108,1.05,United Kingdom
pink strawberry handbag ,16207A,2.95,United Kingdom
mirrored wall art table lamp,21372,2.95,United Kingdom
small skull windmill,21747,1.25,United Kingdom
set/3 rabbits flower skippping rope,84457,0.85,United Kingdom
beaded crystal heart green large,85130B,1.65,United Kingdom
"greeting card,square, doughnuts",84249A,0.42,United Kingdom
dinosaur height chart sticker set,21251,2.95,United Kingdom
hot water bottle babushka large,22837,4.65,Switzerland
birthday banner tape,22953,1.25,Switzerland
mini jigsaw go to the fair,22538,0.42,Switzerland
white heart confetti in tube,21198,0.42,United Kingdom
glass bead hoop earrings black,90027A,2.95,United Kingdom
glass bead hoop earrings amethyst,90027D,2.95,United Kingdom
silver m.o.p orbit bracelet,90019A,4.95,United Kingdom
murano style glass bracelet red,90040A,3.5,United Kingdom
green murano twist bracelet,90120C,4.25,United Kingdom
murano style glass bracelet black,90040B,3.5,United Kingdom
cannabis leaf bead curtain,44228,0.85,United Kingdom
opium scented votive candle,85230A,0.21,United Kingdom
"letter ""d"" bling key ring",90214D,1.25,United Kingdom
love heart trinket pot,22066,1.45,United Kingdom
pink pot plant candle,20932,3.75,United Kingdom
glow in dark dolphins,84199,0.21,United Kingdom
lavender scent cake candle,72225C,0.29,United Kingdom
french blue metal door sign 7,22682,1.25,United Kingdom
yellow dragonfly helicopter,85135A,7.95,United Kingdom
chest natural wood 20 drawers,22823,125.0,United Kingdom
wheelbarrow for children ,22526,12.75,United Kingdom
childs garden rake pink,22517,2.1,United Kingdom
baking set 9 piece retrospot ,22138,4.95,United Kingdom
pink paper parasol ,15044A,2.95,United Kingdom
12 egg house painted wood,22282,12.75,United Kingdom
pink metal chicken heart ,84459A,1.25,Netherlands
green cat floral cushion cover ,20700,3.75,United Kingdom
edwardian drop earrings jet black,90022,3.75,United Kingdom
purple frangipani hairclip,90104,0.85,United Kingdom
black flower candle plate,84499,0.85,United Kingdom
blue egg  spoon,21403,0.42,United Kingdom
vintage red teatime mug,21067,1.25,United Kingdom
popart wooden pencils asst,16045,0.12,Belgium
red polkadot beaker ,21394,1.95,Germany
set of 36 dinosaur paper doilies,21972,1.45,Germany
tea party  wrapping paper ,22046,0.42,Germany
white rosebud  pearl earrings,90165B,2.55,United Kingdom
red purse with pink heart,16206B,1.25,United Kingdom
blue chenille shaggy cushion cover ,46138B,1.95,United Kingdom
pink cat floral cushion cover ,20701,3.75,United Kingdom
vintage glass tea caddy,21661,5.95,United Kingdom
relax large wood letters,21359,15.95,United Kingdom
flowers tile coaster,84926E,0.42,United Kingdom
jardin etched glass cheese dish,85144,7.25,United Kingdom
