Description,StockCode,UnitPrice,Country
french chateau large fruit bowl ,85028L,1.95,United Kingdom
antique cream cutlery cupboard,21270,12.75,EIRE
envelope 50 romantic images,85017A,0.85,United Kingdom
pink rosebud pearl bracelet,90164A,7.5,United Kingdom
pink murano twist necklace,90124A,9.95,United Kingdom
green murano twist necklace,90124C,9.95,United Kingdom
green  diamante pen in gift box,21847,4.95,United Kingdom
wrap carousel,16156L,0.42,United Kingdom
necklace+bracelet set blue hibiscus,90099,2.55,United Kingdom
orange felt vase + flowers,84743C,1.25,United Kingdom
set of 6 nativity magnets ,23157,2.08,France
silver/black orbit necklace,90014C,9.95,United Kingdom
vintage bead cosmetic bag ,35649,3.35,United Kingdom
enamel blue rim tea container,35809B,0.83,United Kingdom
beach hut mirror,84686,4.25,United Kingdom
mirror mosaic candle plate,22104,1.45,United Kingdom
hen house with chick standing,84228,0.42,United Kingdom
black photo album ,16202E,0.5,United Kingdom
tumbler baroque,79030D,0.39,United Kingdom
goldie looking mirror,20821,4.95,United Kingdom
pink round compact mirror,84877A,1.25,United Kingdom
blue square compact mirror,84875D,1.25,United Kingdom
mirror mosaic hurricane lamp ,22106,6.75,United Kingdom
decoration wobbly chicken,22287,1.65,EIRE
decoration wobbly rabbit metal ,22286,1.65,United Kingdom
teatime funky flower backpack for 2,84872A,16.95,United Kingdom
childrens cutlery dolly girl ,23254,4.15,United Kingdom
childrens cutlery spaceboy ,23256,4.15,United Kingdom
new baroque b'fly necklace pink,90024D,8.5,United Kingdom
childrens cutlery circus parade,23255,4.15,United Kingdom
tumbler new england,79030G,0.39,United Kingdom
botanical lily gift wrap,22039,0.42,United Kingdom
antique opal white flower earrings,90001C,4.25,United Kingdom
baroque butterfly earrings black,90025A,3.75,United Kingdom
mop pendant shell necklace,90142D,4.95,United Kingdom
yellow/orange flower design plate,37487B,0.29,United Kingdom
charlotte bag vintage alphabet ,23205,0.85,United Kingdom
jumbo bag alphabet,23201,2.08,United Kingdom
lunch bag alphabet design,23207,1.65,United Kingdom
jumbo bag apples,23199,2.08,United Kingdom
lunch bag apple design,23206,1.65,United Kingdom
charlotte bag apples design,23204,0.85,United Kingdom
charlotte bag alphabet  design,23205,0.85,United Kingdom
kids cutlery spaceboy ,23256,4.15,United Kingdom
kids cutlery dolly girl ,23254,4.15,United Kingdom
lunch bag vintage leaf design,23208,1.65,United Kingdom
hardman mug 3 assorted,37468,0.39,United Kingdom
s/2 beach hut treasure chests,84689,5.95,United Kingdom
blue padded soft mobile,20703,4.25,United Kingdom
pink feathers curtain,44242B,1.25,Germany
woven bubble gum cushion cover,46776A,4.95,United Kingdom
woven rose garden cushion cover ,46776F,4.95,United Kingdom
woven sunset cushion cover ,46776D,4.95,United Kingdom
pads to match all cushions,PADS,0.001,United Kingdom
squarecushion cover pink union jack,22785,6.75,United Kingdom
3 birds canvas screen,84731,1.65,United Kingdom
large deco jewellery stand,23065,12.5,United Kingdom
pastel blue photo album ,16202B,0.5,United Kingdom
heart beaded trellis decoration,23060,2.08,United Kingdom
gemstone chandelier t-light holder,23057,4.15,United Kingdom
beaded chandelier t-light holder,23057,4.95,United Kingdom
small deco jewellery stand,23066,8.25,United Kingdom
aluminium stamped heart,23068,2.49,United Kingdom
double ceramic parlour hook,23075,4.15,United Kingdom
zinc sweetheart wire letter rack,23153,3.75,United Kingdom
parlour ceramic wall hook,23075,4.15,United Kingdom
georgian trinket box,23073,12.5,United Kingdom
crochet white rabbit keyring ,84549,1.65,United Kingdom
set of 12 rose botanical t-lights,21614,2.95,United Kingdom
blue cat biscuit barrel pink heart,84576,1.95,United Kingdom
triple hook antique ivory rose,23146,3.29,United Kingdom
vintage embossed heart,23061,1.25,United Kingdom
gold wine goblet,20823,0.79,United Kingdom
gold aperitif glass,20827,0.39,United Kingdom
ivory chandelier t-light holder,23055,6.25,United Kingdom
flowers chandelier t-light holder,23056,6.25,United Kingdom
triple wire hook ivory heart,23140,4.15,United Kingdom
triple wire hook pink heart,23141,4.15,United Kingdom
small zinc heart wall organiser,23135,5.75,United Kingdom
small ivory heart wall organiser,23132,5.75,United Kingdom
marie antoienett trinket box gold,23071,12.5,United Kingdom
ivory sweetheart wire letter rack ,23152,3.75,United Kingdom
large zinc heart wall organiser,23134,7.05,United Kingdom
large ivory heart wall organiser,23133,7.05,United Kingdom
60 gold and silver fairy cake cases,84990,0.55,United Kingdom
single antique rose hook ivory,23147,1.45,United Kingdom
miniature antique rose hook ivory,23148,0.83,United Kingdom
zinc t-light holder stars small,23144,0.72,United Kingdom
ivory wire kitchen organiser,23142,10.4,United Kingdom
ivory wire sweetheart letter tray,23136,3.75,United Kingdom
single wire hook pink heart,23139,1.45,United Kingdom
single wire hook ivory heart,23138,1.45,United Kingdom
ivory sweetheart soap dish,23150,2.49,United Kingdom
zinc t-light holder star large,23145,0.95,United Kingdom
16 piece cutlery set pantry design,23253,15.95,United Kingdom
pink butterfly cushion cover,84906,1.95,United Kingdom
zinc wire sweetheart letter tray,23137,3.75,United Kingdom
painted lightbulb rainbow design,79144C,0.42,United Kingdom
lilac votive candle,72024U,0.21,United Kingdom
teatime gel pens asst,16049,0.42,United Kingdom
orange/wht/fuschia stones necklace,90135,4.95,United Kingdom
white/pink mini crystals necklace,90138,4.95,United Kingdom
cote d'azure necklace,90159,4.95,United Kingdom
white  rosebud pearl bracelet,90164B,7.5,United Kingdom
pink rosebud & pearl necklace,90163A,7.5,United Kingdom
white rosebud & pearl necklace,90163B,7.5,United Kingdom
st tropez necklace,90158,4.95,United Kingdom
riviera necklace,90157,4.95,United Kingdom
cracked glaze necklace red,90051,6.95,United Kingdom
edwardian photo frame,23069,6.25,United Kingdom
maxwell 2 tone blue 60 page photo a,16244B,0.5,United Kingdom
mistletoe heart wreath cream,23131,4.15,United Kingdom
hanging engraved metal heart,23067,4.15,United Kingdom
blue table run flower,47341B,1.25,United Kingdom
blue stripes shoulder bag,62097B,0.83,United Kingdom
blue check bag w handle 34x20cm,62043B,0.83,United Kingdom
laser cut multi strand necklace,90021,11.95,United Kingdom
regency sugar tongs,23163,2.49,United Kingdom
doormat keep calm and come in,23284,6.75,United Kingdom
doormat vintage leaves design ,23283,7.95,United Kingdom
green enamel flower ring,90201D,2.95,United Kingdom
red enamel flower ring,90201C,2.95,United Kingdom
purple enamel flower ring,90201A,2.95,United Kingdom
cd wall tidy blue office,71495A,0.36,United Kingdom
regency tea strainer,23162,3.75,United Kingdom
small zinc/glass candleholder,72811,1.25,United Kingdom
gold flower cushion cover ,20816,1.95,United Kingdom
set of 10 lanterns fairy light star,23048,4.15,United Kingdom
paper lantern 7 point snow star,23042,6.65,United Kingdom
paper lantern 9 point snow star,23041,4.15,United Kingdom
paper lantern 9 point snow star ,23040,5.75,United Kingdom
cinderella chandelier ,23064,49.95,United Kingdom
bling key ring stand,85225,1.25,United Kingdom
mistletoe heart wreath green,23130,4.15,United Kingdom
white 3 frame birds and tree ,84629,21.95,United Kingdom
french lattice cushion cover ,20835,0.83,United Kingdom
wrap summer rose design,22987,0.42,United Kingdom
french paisley cushion cover,20836,0.83,United Kingdom
regency tea spoon,23160,1.04,United Kingdom
regency cake fork,23161,1.04,United Kingdom
regency cake slice,23164,4.15,United Kingdom
antique ivory wire bowl small,23149,2.49,United Kingdom
miniture antique rose hook ivory,23148,0.85,United Kingdom
pink flock photo frame ,84705C,1.25,United Kingdom
zinc wire kitchen organiser,23143,10.4,United Kingdom
food cover with beads set 2 ,23299,3.75,United Kingdom
spotty bunting,23298,4.95,United Kingdom
edwardian heart photo frame,23070,4.15,United Kingdom
zinc sweetheart soap dish,23151,2.49,United Kingdom
crystal stud earrings clear display,90058A,0.38,United Kingdom
paper lantern 9 point holly star 40,23043,6.25,United Kingdom
paper lantern 5 point star moon 30,23045,4.15,United Kingdom
paper lantern 6 point snow star,23041,4.15,United Kingdom
pink and white christmas tree 120cm,35599D,2.95,United Kingdom
"bunting , spotty ",23298,4.15,United Kingdom
polyester filler pad 60x40cm,20964,2.55,United Kingdom
blue disco handbag,84859B,1.95,United Kingdom
lunch bag doiley pattern ,23209,1.65,United Kingdom
jumbo bag pears,23200,2.08,United Kingdom
jumbo bag doiley patterns,23203,2.08,United Kingdom
montana diamond cluster earrings,90076,2.55,EIRE
marie antoinette trinket box gold,23071,12.5,EIRE
marie antoinette trinket box silver,23072,12.5,EIRE
jumbo bag vintage leaf,23202,2.08,United Kingdom
paper lantern 9 point holly star l,23043,6.25,United Kingdom
paper lantern 9 point deluxe star,23046,6.65,United Kingdom
paper lantern 5 point sequin star,23047,5.75,United Kingdom
paper lantern 9 point holly star s,23044,4.15,United Kingdom
paper lantern 9 point holly star 23,23044,4.15,United Kingdom
paper lantern 5 point studded star,23047,5.75,United Kingdom
"food cover with beads , set 2 sizes",23299,3.75,United Kingdom
rasta in bath w spliff ashtray,35443,0.85,United Kingdom
flower garland necklace red,90036A,7.95,United Kingdom
ivory shell heart earrings,90033,2.55,United Kingdom
turq stone/crystal earrings,90130B,2.95,United Kingdom
"flower glass garland neckl.36""blue",90036C,7.95,United Kingdom
folding butterfly mirror ivory ,23282,0.83,United Kingdom
folding butterfly mirror hot pink ,23280,0.83,United Kingdom
bundle of 3 school exercise books  ,23190,1.65,United Kingdom
bundle of 3 retro note books,23191,1.65,United Kingdom
green goose feather tree 60cm,21263,1.95,United Kingdom
pink goose feather tree 60cm,21265,1.95,United Kingdom
white goose feather tree 60cm ,21264,1.95,United Kingdom
bundle of 3 retro exercise books,23191,1.65,United Kingdom
regency milk jug pink ,23175,3.25,United Kingdom
regency sugar bowl green,23174,4.15,United Kingdom
regency teapot roses ,23173,8.15,United Kingdom
regency tea plate pink,23172,1.65,United Kingdom
regency tea plate green ,23171,1.65,United Kingdom
regency tea plate roses ,23170,1.65,United Kingdom
green metal box army supplies,23081,8.25,United Kingdom
rabbit night light,23084,2.08,United Kingdom
folding butterfly mirror red  ,23281,0.83,United Kingdom
parisienne jewellery drawer ,23118,7.5,United Kingdom
petit tray chic,23096,1.65,United Kingdom
zinc herb garden container,23091,6.25,United Kingdom
le grand tray chic set,23094,12.5,United Kingdom
set of 10 led dolly lights,23108,6.25,United Kingdom
red metal box top secret,23080,8.25,United Kingdom
green metal box top secret,23081,8.25,United Kingdom
parisienne key cabinet ,23110,5.75,United Kingdom
bundle of 3 alphabet exercise books,23192,1.65,United Kingdom
silver bells table decoration,23100,1.25,United Kingdom
silver hearts table decoration,23102,0.83,United Kingdom
vintage engraved heart,23061,1.25,United Kingdom
set 6 paper table lantern hearts ,23082,3.75,United Kingdom
flowers handbag blue and orange,16151A,1.25,United Kingdom
small parisienne heart photo frame ,23093,2.49,United Kingdom
folding mirror hot pink ,23280,0.83,United Kingdom
led tea lights,23109,2.49,United Kingdom
bell heart decoration,23103,1.65,United Kingdom
aluminium heart,23068,2.49,United Kingdom
crystal chandelier t-light holder,23056,6.25,United Kingdom
parisienne curio cabinet,23112,7.5,United Kingdom
parisienne sewing box,23111,12.5,France
toadstool bedside light ,23079,8.95,France
small ceramic top storage jar ,23167,0.69,United Kingdom
ivory pantry hanging lamp ,23104,12.5,United Kingdom
classic sugar dispenser,23168,1.25,United Kingdom
large zinc glass candleholder,72812,2.1,Germany
miseltoe heart wreath white,23131,3.75,Netherlands
miseltoe heart wreath ,23130,3.75,Netherlands
classic glass sweet jar,23169,4.15,Netherlands
large ceramic top storage jar,23165,1.45,Netherlands
large jewellery stand,23065,12.5,United Kingdom
small jewellery stand,23066,8.25,United Kingdom
silver stars table decoration,23101,0.83,United Kingdom
glass bon bon jar,23089,1.65,United Kingdom
white wire plant pot holder,23107,2.89,United Kingdom
classic glass cookie jar,23169,4.15,United Kingdom
fire polished glass bracelet green,90039D,3.75,United Kingdom
fire polished glass bracelet montan,90039B,3.75,United Kingdom
fire polished glass bracelet red,90039A,3.75,United Kingdom
classic cafe sugar dispenser,23168,1.25,United Kingdom
jingle bell heart decoration,23103,1.65,United Kingdom
zinc hearts plant pot holder,23106,2.89,United Kingdom
white hearts wire plant pot holder,23107,2.89,United Kingdom
zinc  heart t-light holder,23087,1.25,United Kingdom
zinc heart flower t-light holder,23088,1.25,United Kingdom
metal herb gerden container,23091,6.25,United Kingdom
zinc plant pot holder,23106,2.89,United Kingdom
folding mirror ivory ,23282,0.83,United Kingdom
folding mirror red  ,23281,0.83,United Kingdom
"pearl & shell 42""neckl. ivory",90035C,10.75,United Kingdom
gardeners kneeling pad keep calm ,23301,1.65,United Kingdom
gardeners kneeling pad cup of tea ,23300,1.45,United Kingdom
kneeling mat housework  design,23302,1.65,United Kingdom
english rose scented hanging heart,47574B,4.25,United Kingdom
vintage glass t-light holder,23090,0.83,United Kingdom
set 6 paper table lantern stars ,23083,3.75,United Kingdom
large antique white photo frame,23092,7.9,United Kingdom
antique silver bauble lamp  ,23085,10.4,United Kingdom
french carriage lantern,23099,6.65,United Kingdom
zinc  star t-light holder ,23086,1.25,United Kingdom
white square table clock,84661A,2.55,United Kingdom
"letter ""y"" bling key ring",90214Y,1.25,United Kingdom
funky flower picnic bag for 4,84873A,16.95,United Kingdom
dark bird house tree decoration,21015,0.85,United Kingdom
multicolour polkadot plate,37471,0.85,United Kingdom
set 10 night owl lights,22179,6.75,United Kingdom
heart shaped holly wreath,23129,4.15,United Kingdom
blue delphinium artificial flower,84804B,2.95,United Kingdom
ivory cafe hanging lamp ,23104,12.5,United Kingdom
pink enamel flower hair tie,90202D,2.95,Germany
red peony cushion cover ,84984B,4.65,United Kingdom
green peony cushion cover,84984A,4.65,United Kingdom
clear crystal star phone charm,90093,0.85,United Kingdom
crystal stiletto phone charm,90085,0.85,United Kingdom
silver flowr pink shell necklace,90149,7.5,United Kingdom
silver drop earrings with flower,90144,3.75,United Kingdom
green vintage earrings ,90013C,3.75,United Kingdom
cracked glaze necklace ivory,90050,6.95,United Kingdom
ivory pendant triple shell necklace,90141B,4.95,United Kingdom
zinc t-light holder stars large,23145,0.95,United Kingdom
16 pc cutlery set pantry design,23253,15.95,United Kingdom
capiz chandelier,21310,29.95,United Kingdom
pearl and cherry quartz braclet,90041,3.5,United Kingdom
filigree heart bird white ,23228,1.25,United Kingdom
filigree heart butterfly white ,23227,1.25,United Kingdom
zinc star t-light holder ,23086,1.25,United Kingdom
amber bertie glass bead bag charm,90125E,2.1,United Kingdom
next day carriage,23444,15.0,United Kingdom
decoration sitting bunny,22268,0.85,United Kingdom
cherry blossom purse,20667,2.95,United Kingdom
filigree heart daisy white,23226,1.25,United Kingdom
pink oval shape trinket box,84711B,9.95,Switzerland
champagne tray blank card,84206C,0.19,United Kingdom
jingle bell heart antique gold,23214,2.08,United Kingdom
jingle bell heart antique silver,23215,2.08,United Kingdom
diamante hair grip pack/2 lt rose,90059F,1.65,United Kingdom
pair of pink flower cluster slide,90208,2.55,United Kingdom
white rocking horse hand painted,23210,1.25,Germany
star wreath decoration with bell,23213,1.25,Germany
heart wreath decoration with bell,23212,1.25,Germany
laurel star antique silver ,23219,1.25,Germany
cherub heart decoration gold,23224,0.83,Germany
reindeer heart decoration silver,23221,0.83,Germany
red rocking horse hand painted,23211,1.04,United Kingdom
laurel heart antique gold,23216,1.04,United Kingdom
laurel heart antique silver,23217,1.04,United Kingdom
cherub heart decoration silver ,23225,0.72,United Kingdom
set 2 tea towels i love london ,22900,3.25,United Kingdom
set of 3 hanging owls ollie beak,23275,1.25,United Kingdom
set of 3 wooden heart decorations,23263,1.25,United Kingdom
paper lantern 5 point star moon ,23045,4.15,United Kingdom
set of 60 i love london cake cases ,23309,0.55,Germany
set of 6 halloween ghost t-lights,72586,0.42,Germany
set of 2 ceramic painted hearts ,23270,1.45,United Kingdom
crystal diamante star brooch,90206C,4.95,United Kingdom
gold diamante star brooch,90206A,4.95,United Kingdom
pink/blue disc/mirror string,84422,0.85,United Kingdom
set of 60 pantry design cake cases ,23307,0.55,United Kingdom
set of 36 doilies pantry design,23306,1.45,United Kingdom
set of 60 vintage leaf cake cases ,23308,0.55,United Kingdom
heart t-light holder willie winkie,23273,1.65,United Kingdom
star t-light holder willie winkie,23274,1.65,United Kingdom
set 4 valentine decoupage heart box,85184C,2.95,United Kingdom
"acrylic jewel icicle, pink",35818P,0.38,United Kingdom
wrap gingham rose ,22986,0.42,United Kingdom
mirrored wall art snowflakes,21373,0.75,United Kingdom
pop art push down rubber ,16043,0.12,United Kingdom
"letter ""e"" bling key ring",90214E,1.25,United Kingdom
white frangipani hair clip,90102,0.85,United Kingdom
set of 4 knick knack tins doiley ,23240,4.15,United Kingdom
set of 4 knick knack tins london ,23238,4.15,United Kingdom
set of tea coffee sugar tins pantry,23243,4.15,United Kingdom
black square table clock,84661B,2.55,Malta
pink flock suede cushion cover ,84415A,1.25,Malta
set of 3 regency cake tins,23245,4.95,United Kingdom
set of 4 knick knack tins poppies,23239,4.15,United Kingdom
doiley storage tin,23236,2.89,United Kingdom
storage tin vintage leaf,23235,2.89,United Kingdom
treasure tin gymkhana design,23241,2.08,United Kingdom
treasure tin buffalo bill ,23242,2.08,United Kingdom
biscuit tin 50's christmas,23247,2.89,United Kingdom
round storage tin vintage leaf,23244,1.95,United Kingdom
set of 4 knick knack tins leaves ,23237,4.15,United Kingdom
36 doilies vintage christmas,22950,1.45,United Kingdom
folkart christmas tree t-light hold,35966,0.38,United Kingdom
small white heart of wicker,23321,1.69,United Kingdom
doiley biscuit tin,23236,2.89,United Kingdom
bubblegum ring assorted,23310,0.42,United Kingdom
"letter ""l"" bling key ring",90214L,1.25,United Kingdom
"letter ""n"" bling key ring",90214N,1.25,United Kingdom
"letter ""h"" bling key ring",90214H,1.25,United Kingdom
reindeer heart decoration gold,23220,0.83,Belgium
fruit salad bag charm,90116,1.69,United Kingdom
danish rose umbrella stand,84824,15.95,United Kingdom
the king gift bag,16162L,0.65,United Kingdom
picnic basket wicker 60 pieces,22502,649.5,United Kingdom
zinc folkart sleigh bells,35970,1.69,United Kingdom
set of 3 wooden stocking decoration,23266,1.25,United Kingdom
set of 3 wooden tree decorations,23265,1.25,United Kingdom
set of 3 wooden sleigh decorations,23264,1.25,United Kingdom
set of 2 ceramic christmas trees,23269,1.45,United Kingdom
set of 2 ceramic christmas reindeer,23268,1.45,United Kingdom
vintage red enamel trim jug ,23252,3.75,United Kingdom
large white heart of wicker,23322,2.95,United Kingdom
popcorn holder,22197,0.85,United Kingdom
dolphin windmill,77079,2.12,United Kingdom
blue vintage spot beaker,23286,0.85,United Kingdom
egg frying pan red ,23338,2.08,United Kingdom
pink vintage spot beaker,23285,0.85,United Kingdom
green vintage spot beaker,23288,0.85,United Kingdom
vintage keepsake box pink flower,20901,6.35,United Kingdom
jumbo bag vintage christmas ,23343,2.08,United Kingdom
small pop box funky monkey,47310M,1.25,United Kingdom
christmas star wish list chalkboard,22596,1.25,United Kingdom
glass bead hoop necklace black,90026A,8.5,United Kingdom
"flower glass garland neckl.36""green",90036B,7.95,United Kingdom
vintage enamel & crystal necklace,90079,4.95,United Kingdom
antique raspberry flower earrings,90001A,4.25,United Kingdom
antique olive green flower earrings,90001D,4.25,United Kingdom
antique mid blue flower earrings,90001B,4.25,United Kingdom
gold/amber drop earrings w leaf,90190B,2.95,United Kingdom
silver/crystal drop earrings w leaf,90190A,2.95,United Kingdom
green drop earrings w bead cluster,90187B,3.35,United Kingdom
christmas table candle silver spike,23271,0.83,United Kingdom
egg frying pan ivory ,23335,2.08,United Kingdom
egg frying pan blue ,23339,2.08,United Kingdom
egg frying pan pink ,23336,2.08,United Kingdom
egg frying pan mint ,23337,2.08,United Kingdom
space boy childrens cup,23292,1.25,United Kingdom
dolly girl childrens cup,23291,1.25,United Kingdom
dolly girl childrens bowl,23289,1.25,United Kingdom
spaceboy childrens bowl,23290,1.25,United Kingdom
red vintage spot beaker,23287,0.85,United Kingdom
rose du sud cushion cover ,20997,4.95,United Kingdom
vintage  2 meter folding ruler,23188,1.65,United Kingdom
biscuit tin vintage leaf,23235,2.89,United Kingdom
cannister vintage leaf design,23244,1.95,United Kingdom
vintage red enamel trim mug ,23251,1.25,United Kingdom
vintage red enamel trim plate,23249,1.65,United Kingdom
vintage red trim enamel bowl ,23250,1.25,United Kingdom
vintage donkey tail game ,23229,3.39,United Kingdom
biscuit tin vintage christmas,23234,2.89,United Kingdom
glass apothecary bottle perfume,23012,3.95,United Kingdom
glass apothecary bottle elixir,23014,3.95,United Kingdom
drawer knob ceramic ivory,23035,1.45,United Kingdom
crochet dog keyring,84551,1.65,United Kingdom
glass  songbird storage jar,23020,12.5,United Kingdom
drawer knob crackle glaze ivory,23032,1.65,United Kingdom
drawer knob crackle glaze blue,23028,1.65,United Kingdom
drawer knob crackle glaze pink,23031,1.65,United Kingdom
drawer knob crackle glaze green,23029,1.65,United Kingdom
drawer knob ceramic red,23033,1.45,United Kingdom
drawer knob ceramic black,23034,1.45,United Kingdom
glass apothecary bottle tonic,23013,3.95,United Kingdom
donkey tail game ,23229,3.39,United Kingdom
transparent acrylic tape dispenser,16254,0.85,United Kingdom
 toadstool bedside light ,23079,8.95,United Kingdom
jumbo bag 50's christmas ,23344,2.08,United Kingdom
gold fabric mirror,20869,0.39,United Kingdom
doorknob cracked glaze ivory,23032,1.45,EIRE
doorknob cracked glaze blue,23028,1.45,EIRE
small bonne jam jar  t-light holder,23022,1.79,United Kingdom
glass twist bon bon jar,23016,6.65,United Kingdom
drawer knob vintage glass star,23026,1.79,United Kingdom
pack of 6 large fruit straws ,23119,0.62,United Kingdom
spaceboy childrens cup,23292,1.25,United Kingdom
cocktail swords 50 pieces,23123,0.83,United Kingdom
party charms 50 pieces,23122,0.83,United Kingdom
pack of 6 small fruit straws,23120,0.42,United Kingdom
pack of 6 cocktail parasol straws,23121,0.42,United Kingdom
18pc wooden cutlery set disposable,23124,1.25,United Kingdom
6pc wood plate set disposable,23125,1.25,United Kingdom
t-light holder silver heart handle,23039,1.95,United Kingdom
black baroque carriage clock,85168B,9.95,Canada
pink stocking christmas decoration,35933,0.38,Norway
ridged bonne jam jar t-light holder,23023,1.65,United Kingdom
classical rose table lamp,84679,19.95,United Kingdom
small apothecary measuring jar ,23019,8.25,Norway
pink clear glass candle plate,72369A,1.25,United Kingdom
tree t-light holder willie winkie,23272,1.65,United Kingdom
t-light holder silver petit four ,23036,1.25,United Kingdom
glass bonne jam jar,23021,4.15,United Kingdom
wrap vintage leaf design,23232,0.42,United Kingdom
pantry magnetic  shopping list,23198,1.45,United Kingdom
drawer knob vintage glass hexagon,23027,2.08,United Kingdom
cordial glass jug,23015,8.25,United Kingdom
large bonne jam jar  t-light holder,23024,2.89,United Kingdom
christmas tree hanging silver ,23223,0.83,United Kingdom
christmas tree hanging gold,23222,0.83,United Kingdom
sketchbook magnetic shopping list,23197,1.45,United Kingdom
retro leaves magnetic notepad,23196,1.45,United Kingdom
doormat christmas village,22687,7.95,United Kingdom
set of 4 santa place settings,23267,1.25,Denmark
white wicker star ,23323,2.1,United Kingdom
ivory refectory clock,23315,9.95,United Kingdom
red refectory clock ,23316,9.95,United Kingdom
mint diner wall clock,23342,8.5,United Kingdom
pink diner wall clock,23341,8.5,United Kingdom
reto leaves magnetic shopping list,23196,1.45,United Kingdom
candle holder silver madeline,23037,1.65,United Kingdom
vegetable magnetic  shopping list,23197,1.45,United Kingdom
christmas table silver candle spike,23271,0.83,EIRE
diamante necklace purple,90176D,7.5,United Kingdom
blue refectory clock ,23317,9.95,United Kingdom
apothecary measuring jar,23017,12.5,United Kingdom
large apothecary measuring jar ,23018,12.5,United Kingdom
doorknob cracked glaze pink,23031,1.65,EIRE
doorknob cracked glaze green,23029,1.65,EIRE
drawer knob vintage glass ball,23025,2.08,United Kingdom
glass songbird storage jar,23020,11.15,Netherlands
set of 2 tea towels ping microwave,22124,2.95,United Kingdom
silver book mark with beads,71143,0.85,United Kingdom
bell heart antique gold,23214,2.08,United Kingdom
travel card wallet vintage leaf,22999,0.42,United Kingdom
pink easter hens+flower,84746,3.75,United Kingdom
leaves magnetic  shopping list,23196,1.45,United Kingdom
vip passport cover ,20622,2.1,United Kingdom
garage key fob,21899,0.65,United Kingdom
round blue clock with sucker,81952B,0.19,United Kingdom
round purple clock with sucker,81952V,0.19,United Kingdom
flower purple clock with sucker,81950V,0.29,United Kingdom
flower blue clock with sucker,81950B,0.29,United Kingdom
set of 4 knick knack tins leaf,23237,4.15,United Kingdom
giant 50's christmas cracker,23320,2.89,United Kingdom
moroccan beaten metal dish,21344,9.95,United Kingdom
packing charge,23574,7.5,United Kingdom
