Description,StockCode,UnitPrice,Country
balloon pump with 10 balloons,22434,1.95,United Kingdom
alphabet stencil craft,22564,1.25,United Kingdom
3 traditional biscuit cutters  set,22965,2.1,United Kingdom
ivory paper cup cake cases ,21215,0.42,United Kingdom
party invites woodland,21058,0.85,United Kingdom
party invites balloon girl,21060,0.85,United Kingdom
lovely bonbon sticker sheet,21719,0.85,United Kingdom
sweet pudding sticker sheet,21722,0.85,United Kingdom
asstd design 3d paper stickers,84826,0.85,United Kingdom
cute cats tape,21881,0.65,United Kingdom
toothpaste tube pen,22422,0.65,United Kingdom
magic drawing slate purdey,22536,0.42,United Kingdom
pack of 12 coloured pencils,22491,0.85,United Kingdom
toast its - i love you ,21355,1.25,United Kingdom
bank account  greeting  card ,21518,0.42,United Kingdom
empire birthday card,22023,0.42,United Kingdom
tea party birthday card,22027,0.42,United Kingdom
card cat and tree ,22718,0.42,United Kingdom
card dog and ball ,22717,0.42,United Kingdom
penny farthing birthday card,22028,0.42,United Kingdom
blue stripe ceramic drawer knob,21669,1.25,United Kingdom
red spot ceramic drawer knob,21671,1.25,United Kingdom
white spot blue ceramic drawer knob,21673,1.25,United Kingdom
"hook, 1 hanger ,magic garden",22245,0.85,United Kingdom
embossed glass tealight holder,22460,1.25,United Kingdom
watering can pink bunny,22432,1.95,United Kingdom
watering can green dinosaur,22433,1.95,United Kingdom
watering can blue elephant,22431,1.95,United Kingdom
flying pig watering can,84674,2.95,United Kingdom
vintage billboard tea mug,21069,1.25,United Kingdom
vintage billboard mug ,21070,1.25,United Kingdom
lipstick pen red,22419,0.42,United Kingdom
french blue metal door sign 1,22676,1.25,United Kingdom
french bathroom sign blue metal,22672,1.65,United Kingdom
yellow giant garden thermometer,22928,5.95,United Kingdom
"cakestand, 3 tier, loveheart",22776,9.95,United Kingdom
glass bell jar small,22778,3.95,United Kingdom
glass bell jar large,22777,8.5,United Kingdom
watering can garden marker,22477,1.25,United Kingdom
kings choice mug,21875,1.25,United Kingdom
fridge magnets la vie en rose,22924,0.85,United Kingdom
red retrospot round cake tins,21217,9.95,United Kingdom
coffee mug cat + bird design,22301,2.55,United Kingdom
pin cushion babushka pink,22446,3.35,United Kingdom
brocante shelf with hooks,22832,10.75,United Kingdom
green polkadot bowl,20674,1.25,United Kingdom
red retrospot bowl,20676,1.25,United Kingdom
area patrolled metal sign,82582,2.1,United Kingdom
picture frame wood triple portrait,22170,6.75,United Kingdom
skulls  stickers,21679,0.85,United Kingdom
set3 book box green gingham flower ,21428,4.25,United Kingdom
potting shed tea mug,21868,1.25,United Kingdom
round cake tin vintage red,22840,7.95,United Kingdom
retro plastic elephant tray,79191C,0.85,United Kingdom
gold mini tape measure ,20733,0.85,United Kingdom
rainbow pegs photo clip string,47471,0.65,United Kingdom
teatime pen case & pens,16046,0.85,United Kingdom
photo frame 3 classic hanging,22796,9.95,United Kingdom
3d traditional christmas stickers,22733,1.25,United Kingdom
traditional modelling clay,22560,1.25,United Kingdom
seaside flying disc,22559,1.25,United Kingdom
peg bag apples design,22896,2.55,United Kingdom
grey floral feltcraft shoulder bag,20967,3.75,United Kingdom
charlie lola blue hot water bottle ,84031B,4.65,United Kingdom
set/3 red gingham rose storage box,21430,3.75,United Kingdom
glass heart t-light holder ,21313,0.85,United Kingdom
tea time party bunting,47566B,4.65,United Kingdom
wooden union jack bunting,22499,5.95,United Kingdom
paper bunting retrospot,22090,2.95,United Kingdom
small white retrospot mug in box ,22071,3.75,United Kingdom
small red retrospot mug in box ,22070,3.75,United Kingdom
"set 3 retrospot tea,coffee,sugar",21216,4.95,United Kingdom
12 pencils tall tube red retrospot,20983,0.85,United Kingdom
red retrospot pudding bowl,21537,4.25,United Kingdom
red retrospot traditional teapot ,21527,7.95,United Kingdom
dairy maid  pudding bowl,21538,3.75,United Kingdom
assorted cakes fridge magnets,85216,0.65,United Kingdom
food container set 3 love heart ,22131,1.95,United Kingdom
do not touch my stuff door hanger ,21163,1.45,United Kingdom
moody girl door hanger ,21158,1.45,United Kingdom
keep out boys door hanger ,21161,1.45,United Kingdom
moody boy  door hanger ,21159,1.45,United Kingdom
filigris heart with butterfly,21390,1.25,United Kingdom
heart decoration painted zinc ,22335,0.65,United Kingdom
"decoration hen on nest, hanging",22285,1.65,United Kingdom
hen house decoration,22284,1.65,United Kingdom
pack of 12 sticky bunnies,21383,0.65,United Kingdom
mini wooden happy birthday garland,21381,1.69,United Kingdom
pink happy birthday bunting,47590B,5.45,United Kingdom
blue happy birthday bunting,47590A,5.45,United Kingdom
wood stamp set best wishes,22210,1.65,United Kingdom
wood stamp set happy birthday,22209,1.65,United Kingdom
wood stamp set thank you,22208,1.65,United Kingdom
glamorous  mug,21872,1.25,United Kingdom
cream wall planter heart shaped,22822,5.95,United Kingdom
jumbo bag spaceboy design,22385,1.95,United Kingdom
red floral feltcraft shoulder bag,20969,3.75,United Kingdom
pink floral feltcraft shoulder bag,20970,3.75,United Kingdom
airline bag vintage jet set red,22374,4.25,United Kingdom
airline bag vintage jet set brown,22375,4.25,United Kingdom
cosy slipper shoes large green,21741,2.95,United Kingdom
white jewelled heart decoration,85061W,0.85,United Kingdom
ivory hanging decoration  heart,21385,0.85,United Kingdom
stripey chocolate nesting boxes,21288,2.95,United Kingdom
christmas tree star decoration,21803,0.42,United Kingdom
christmas tree decoration with bell,21801,0.42,United Kingdom
chinese dragon paper lanterns,40016,0.42,United Kingdom
milk pan pink polkadot,22202,3.75,United Kingdom
boom box speaker boys,21064,5.95,United Kingdom
pink fairy cake childrens apron,47591D,1.95,United Kingdom
small pink magic christmas tree,84341B,0.85,United Kingdom
set of 4 fairy cake placemats ,84509G,3.75,United Kingdom
recycled pencil with rabbit eraser,16235,0.21,United Kingdom
blue calculator ruler,20986,1.25,United Kingdom
red flock love heart photo frame,20832,0.85,United Kingdom
scented candle in digitalis tin,84846A,2.1,United Kingdom
grow your own flowers set of 3,22442,7.95,United Kingdom
red heart shape love bucket ,21563,2.95,United Kingdom
vintage post office cabinet,21769,79.95,United Kingdom
set of 6 3d kit cards for kids,85227,0.85,United Kingdom
clear milkshake glass,20798,2.1,United Kingdom
red baby bunting ,22669,2.95,United Kingdom
birds mobile vintage design,22320,5.95,United Kingdom
woodland  height chart stickers ,21249,2.95,United Kingdom
dinosaur lunch box with cutlery,21561,2.55,United Kingdom
red spotty biscuit tin,21218,3.75,United Kingdom
charlie + lola biscuits tins,85132A,9.95,United Kingdom
charlie and lola table tins,85132B,9.95,United Kingdom
charlie and lola figures tins,85132C,9.95,United Kingdom
cake stand white two tier lace,22215,8.5,United Kingdom
blue polkadot bowl,20675,1.25,United Kingdom
pink  polkadot cup,21239,0.85,United Kingdom
skull and crossbones  garland ,21207,1.65,United Kingdom
pack of 6 skull paper cups,21987,0.65,United Kingdom
pack of 6 skull paper plates,21988,0.85,United Kingdom
pack of 20 skull paper napkins,21989,0.85,United Kingdom
200 bendy skull straws,22316,1.25,United Kingdom
skulls party bag + sticker set,22332,1.65,United Kingdom
set of 9 black skull balloons,22437,0.85,United Kingdom
strawberry honeycomb  garland ,21206,1.65,United Kingdom
pink polkadot bowl,20677,1.25,United Kingdom
set of 6 t-lights wedding cake ,22806,2.95,United Kingdom
mini cake stand t-light holder,22893,0.42,United Kingdom
round cake tin vintage green,22841,7.95,United Kingdom
"black tea,coffee,sugar jars",85159A,6.35,United Kingdom
shoe shine box ,21784,9.95,United Kingdom
bread bin diner style mint,22849,16.95,United Kingdom
vanilla incense 40 cones in tin,17090D,1.25,United Kingdom
lavender incense 40 cones in tin,17090A,1.25,United Kingdom
columbian candle round ,72127,1.25,United Kingdom
columbian candle rectangle,72133,1.25,United Kingdom
zinc finish 15cm planter pots,84763,1.25,United Kingdom
small square cut glass candlestick,85127,4.95,United Kingdom
silk purse babushka blue,22450,3.35,United Kingdom
army camo bookcover tape,10124G,0.42,United Kingdom
carrot charlie+lola coaster set,84519B,2.95,United Kingdom
memo board cottage design,22505,4.95,United Kingdom
childs garden spade blue,22514,2.1,United Kingdom
love heart napkin box ,22862,4.25,United Kingdom
skulls greeting card,21504,0.42,United Kingdom
hanging chick  yellow decoration,22292,1.45,United Kingdom
set of 72 skull paper  doilies,21211,1.45,United Kingdom
set of 36 paisley flower doilies,21974,1.45,United Kingdom
spaceboy gift wrap,22045,0.42,United Kingdom
blue glass chunky charm bracelet,90175C,8.95,United Kingdom
black+white necklace w tassel,90180A,9.95,United Kingdom
amber chunky glass+bead necklace,90178A,11.95,United Kingdom
poppy's playhouse livingroom ,22746,2.1,United Kingdom
gingham rose wrap,22986,0.42,United Kingdom
12 pencils tall tube posy,20984,0.85,United Kingdom
12 coloured party balloons,22436,0.65,United Kingdom
pink flower crochet food cover,21465,3.75,United Kingdom
flower vine raffia food cover,21470,3.75,United Kingdom
food/drink sponge stickers,16012,0.21,United Kingdom
pink heart shape photo frame,85025C,1.65,United Kingdom
lilac diamante pen in gift box,21851,4.95,United Kingdom
silver diamante pen in gift box,21849,4.95,United Kingdom
blue juicy fruit photo frame,85124B,2.55,United Kingdom
green juicy fruit photo frame,85124C,2.55,United Kingdom
glitter butterfly clips,20828,2.55,United Kingdom
assorted creepy crawlies,21830,0.42,United Kingdom
vintage union jack memoboard,21623,9.95,United Kingdom
basket of flowers sewing kit,85177,0.85,United Kingdom
antique silver tea glass etched,84946,1.25,United Kingdom
family album white picture frame,22169,8.5,United Kingdom
wrap pink fairy cakes ,16156S,0.42,United Kingdom
baby boom ribbons ,85049F,1.25,United Kingdom
enamel wash bowl cream,22426,3.75,United Kingdom
local cafe mug,22190,2.1,United Kingdom
diamante bow brooch black colour,90082D,6.35,United Kingdom
diamante bow brooch green colour,90082A,6.35,United Kingdom
diamante bow brooch red colour,90082B,6.35,United Kingdom
lily brooch amethyst colour,90081A,4.95,United Kingdom
pair of enamel butterfly hairclip,90204,3.35,United Kingdom
amethyst diamante expandable ring,90185B,4.25,United Kingdom
purple gemstone bracelet,90195A,8.95,United Kingdom
black gemstone bracelet,90195B,8.95,United Kingdom
purple gemstone necklace 45cm,90196A,12.75,United Kingdom
5 strand glass necklace black,90199A,6.35,United Kingdom
drop diamante earrings crystal,90177C,2.95,United Kingdom
amethyst hoop earring floral leaf,90186A,2.95,United Kingdom
hanging bauble t-light holder large,20894,2.95,United Kingdom
cut glass hexagon t-light holder,85106,2.55,United Kingdom
clam shell small ,21415,2.1,United Kingdom
clam shell large,21416,3.75,United Kingdom
cockle shell dish,21417,2.1,United Kingdom
party pizza dish red retrospot,22343,0.85,United Kingdom
spaceboy tv dinner tray,22474,4.95,United Kingdom
pink tall porcelain t-light holder ,18097A,2.55,United Kingdom
white tall porcelain t-light holder,18097C,2.55,United Kingdom
dolly girl childrens egg cup,22977,1.25,United Kingdom
"key fob , garage design",21899,0.65,United Kingdom
garden metal sign ,21911,1.65,United Kingdom
"key fob , front  door ",21902,0.65,United Kingdom
"key fob , back door ",21901,0.65,United Kingdom
set of 6 cake chopsticks,21948,1.25,United Kingdom
set of 6 strawberry chopsticks,21949,1.25,United Kingdom
chrysanthemum pocket book ,20759,0.85,United Kingdom
garden path pocket book,20760,0.85,United Kingdom
red daisy pocket book ,20757,0.85,United Kingdom
12 pencils tall tube woodland,20981,0.85,United Kingdom
frog sock puppet,85185D,2.95,United Kingdom
pink horse sock puppet,85185B,2.95,United Kingdom
black wine glass,79164,1.65,United Kingdom
classical rose candlestand,84683,1.25,United Kingdom
gaolers keys decorative garden ,21745,3.75,United Kingdom
black champagne glass,79163,1.65,United Kingdom
red retrospot peg bag,21155,2.1,United Kingdom
fairy cake design umbrella,15060B,3.75,United Kingdom
big doughnut fridge magnets,21700,0.85,United Kingdom
"wrap, billboard fonts design",22985,0.42,United Kingdom
gift bag psychedelic apples,22821,0.65,United Kingdom
black enchanted forest placemat,85114A,1.45,United Kingdom
wrap green pears ,22705,0.42,United Kingdom
red retrospot charlotte bag,20724,0.85,United Kingdom
paper chain kit empire,22084,2.95,United Kingdom
charlotte bag pink polkadot,22356,0.85,United Kingdom
toy tidy spaceboy  ,22380,2.1,United Kingdom
4 rose pink dinner candles,72801C,1.25,United Kingdom
4 sky blue dinner candles,72801D,1.25,United Kingdom
two door curio cabinet,21735,12.75,United Kingdom
pink polkadot wrap ,21500,0.42,United Kingdom
assorted colours silk fan,15036,0.75,United Kingdom
spotty pink duck doorstop,21408,4.25,United Kingdom
bank charges,BANK CHARGES,15.0,United Kingdom
red retrospot shopper bag,20718,1.25,United Kingdom
red retrospot butter dish,21539,4.95,United Kingdom
love garland painted zinc ,22341,1.65,United Kingdom
measuring tape babushka pink,22452,2.55,United Kingdom
vintage kid dolly card ,21508,0.36,United Kingdom
"elephant, birthday card, ",21507,0.36,United Kingdom
blue polkadot wrap,21499,0.34,United Kingdom
woodland charlotte bag,20719,0.72,United Kingdom
victorian sewing kit,85178,1.25,United Kingdom
mirror love bird t-light holder,84952C,1.25,United Kingdom
black love bird t-light holder,84952B,1.25,United Kingdom
hanging jam jar t-light holder,71459,0.72,United Kingdom
hand open shape gold,35001G,3.39,United Kingdom
felt farm animal white bunny ,22264,0.85,United Kingdom
red retrospot purse ,20665,2.95,United Kingdom
snowstorm photo frame fridge magnet,22181,0.85,United Kingdom
red polkadot pudding bowl,21392,2.1,United Kingdom
blue polkadot pudding bowl,21393,2.1,United Kingdom
vintage blue tinsel reel,21268,0.42,United Kingdom
jardin etched glass butter dish,85144,7.25,United Kingdom
space frog,21025,1.25,United Kingdom
space cadet black,21031,1.25,United Kingdom
space cadet red,21030,1.25,United Kingdom
space owl,21026,1.25,United Kingdom
space cadet white,21032,1.25,United Kingdom
woodland design  cotton tote bag,21578,2.25,United Kingdom
illustrated cat bowl ,22350,2.55,United Kingdom
toast its - dinosaur,21357,1.25,United Kingdom
garden path sketchbook,20766,3.75,United Kingdom
blue polkadot coffee mug,21399,2.1,United Kingdom
monsters stencil craft,22562,1.25,United Kingdom
citronella candle garden pot,21714,1.25,United Kingdom
modern floral stationery set,21990,2.95,United Kingdom
funky washing up gloves assorted,20751,2.1,United Kingdom
floral folk stationery set,21993,2.95,United Kingdom
blue polkadot washing up gloves,20752,2.1,United Kingdom
childs breakfast set circus parade,22636,8.5,United Kingdom
woodland storage box small,21426,2.1,United Kingdom
skulls  design  cotton tote bag,21581,2.25,United Kingdom
flower burst silver ring crystal,90002D,3.75,United Kingdom
laundry 15c metal sign,82551,1.45,United Kingdom
fanny's rest stopmetal sign,82599,2.1,United Kingdom
chocolate this way metal sign,21908,2.1,United Kingdom
hot baths metal sign,82583,2.1,United Kingdom
pottering in the shed metal sign,21174,1.95,United Kingdom
"key fob , shed",21900,0.65,United Kingdom
love heart pocket warmer,70006,1.65,United Kingdom
botanical lavender birthday card,22031,0.42,United Kingdom
glass cloche large,22777,7.65,United Kingdom
corona mexican tray,79067,3.75,United Kingdom
kids rain mac blue,21788,0.85,United Kingdom
money box confectionery design,22408,1.25,United Kingdom
money box kings choice design,22406,1.25,United Kingdom
money box pocket money design,22405,1.25,United Kingdom
assorted colour t-light holder,84950,0.55,United Kingdom
weekend bag vintage rose paisley,22275,7.65,United Kingdom
ceramic cake bowl + hanging cakes,37450,2.95,United Kingdom
christmas card screen print ,22043,0.42,United Kingdom
christmas card singing angel,22042,0.42,United Kingdom
paper bunting vintage paisley,22089,2.95,United Kingdom
party invites dinosaurs,21059,0.85,United Kingdom
enamel watering can cream,22430,4.95,United Kingdom
enamel colander cream,22425,4.95,United Kingdom
blue polkadot cup,21240,0.85,United Kingdom
frying pan union flag,22207,3.75,United Kingdom
blue/cream stripe cushion cover ,21927,1.25,United Kingdom
union stripe cushion cover ,21925,1.25,United Kingdom
key cabinet ma campagne,22763,9.95,United Kingdom
cream sweetheart mini chest,85066,12.75,United Kingdom
dinosaur party bag + sticker set,22334,1.65,United Kingdom
ivy heart wreath,21349,6.75,United Kingdom
vintage red kitchen cabinet,22655,295.0,United Kingdom
large cake stand hanging hearts,22060,9.95,United Kingdom
large cake stand  hanging strawbery,22061,9.95,United Kingdom
red retrospot sugar jam bowl,21531,2.55,United Kingdom
red retrospot shopping bag,21039,2.55,United Kingdom
red retrospot washbag,21157,2.1,United Kingdom
tea time oven glove,47559B,1.25,United Kingdom
strawberry fairy cake teapot,22649,4.95,United Kingdom
wrap english rose ,16161P,0.42,United Kingdom
wrap  pink flock,16161M,0.42,United Kingdom
tub 24 pink flower pegs,85214,1.65,United Kingdom
feng shui pillar candle,72232,0.19,United Kingdom
"decoupage,greeting card,",84247G,0.42,United Kingdom
novelty biscuits cake stand 3 tier,22890,9.95,United Kingdom
dairy maid toastrack,21530,2.95,United Kingdom
dairy maid traditional teapot ,21528,6.95,United Kingdom
glitter heart garland with bells ,21820,3.75,United Kingdom
glitter star garland with bells ,21821,3.75,United Kingdom
heart garland rustic padded,22162,2.95,United Kingdom
lavender scented fabric heart,21114,1.25,United Kingdom
blue polkadot passport cover,20615,2.1,United Kingdom
set/6 bead coasters gauze bag gold,47021G,1.25,United Kingdom
grow your own herbs set of 3,22443,7.95,United Kingdom
pink polkadot childrens umbrella,20681,3.25,United Kingdom
wooden croquet garden set,22605,14.95,United Kingdom
star decoration rustic,22155,0.42,United Kingdom
white christmas star decoration,21807,0.42,United Kingdom
heart decoration rustic hanging ,22161,0.65,United Kingdom
porcelain t-light holders assorted,20956,1.25,United Kingdom
choc truffle gold trinket pot ,22067,1.65,United Kingdom
wash bag vintage rose paisley,22276,2.55,United Kingdom
cabin bag vintage paisley,22503,29.95,United Kingdom
cabin bag vintage retrospot,22504,29.95,United Kingdom
poppy's playhouse bathroom,22747,2.1,United Kingdom
traditional knitting nancy,22621,1.45,United Kingdom
vintage cream cat food container,22845,6.35,United Kingdom
moroccan tea glass,79000,0.85,United Kingdom
faux fur chocolate throw,22802,19.95,United Kingdom
ribbon reel lace design ,22078,2.1,United Kingdom
lush greens ribbons,85049B,1.25,United Kingdom
pack of 6 sandcastle flags assorted,21878,0.85,United Kingdom
beaded pearl heart white on stick,85131A,1.25,United Kingdom
3 hearts hanging decoration rustic,22158,2.95,United Kingdom
coffee mug dog + ball design,22300,2.55,Germany
hearts wrapping tape ,10123C,0.65,United Kingdom
doggy rubber,10120,0.21,United Kingdom
magic tree -paper flowers,84006,0.85,United Kingdom
blue paisley journal ,20767,2.55,United Kingdom
necklace+bracelet set fruit salad ,90094,2.55,United Kingdom
large purple babushka notebook  ,22758,1.25,United Kingdom
skulls tape,21882,0.65,United Kingdom
cakes and bows gift  tape,21884,0.65,United Kingdom
large yellow babushka notebook ,22756,1.25,United Kingdom
large red babushka notebook ,22757,1.25,United Kingdom
angel decoration 3 buttons ,22154,0.42,United Kingdom
75 green petit four cases,84993A,0.42,United Kingdom
set of 36 teatime paper doilies,84987,1.45,United Kingdom
rose du sud oven glove,20998,2.95,United Kingdom
brown check cat doorstop ,21407,4.25,United Kingdom
black and white cat bowl,22702,2.1,United Kingdom
holiday fun ludo,22550,3.75,United Kingdom
6 ribbons empire  ,22076,1.65,United Kingdom
la palmiera wall thermometer,84925D,2.55,United Kingdom
pack 20 english rose paper napkins,84520B,0.85,United Kingdom
set/20 strawberry paper napkins ,21078,0.85,United Kingdom
assorted incense pack,17084R,0.16,EIRE
vanilla incense in tin,17091J,0.85,EIRE
yuletide images s/6 paper boxes,85018D,2.55,United Kingdom
3d vintage christmas stickers ,22732,1.25,United Kingdom
set/3 floral garden tools in bag,47503J,7.95,United Kingdom
robot mug in display box,37464,1.25,United Kingdom
pack/12 blue folkart cards,84247N,2.95,United Kingdom
"folk art greeting card,pack/12",84247K,2.95,United Kingdom
vintage caravan greeting card ,22035,0.42,United Kingdom
set of skull wall stickers,21250,2.95,United Kingdom
hearts  stickers,21677,0.85,United Kingdom
english rose garden secateurs,47504K,1.95,United Kingdom
"assorted flower colour ""leis""",84212,0.65,United Kingdom
eight piece snake  set,21828,1.25,United Kingdom
small camphor wood field  mushroom,21377,1.65,United Kingdom
camphor wood portobello mushroom,21379,1.25,United Kingdom
pink/green flower design big mug,37489D,1.95,United Kingdom
"flower fairy,5 summer b'draw liners",17107D,2.55,United Kingdom
red love heart shape cup,22132,0.85,United Kingdom
pink love heart shape cup,22133,0.85,United Kingdom
blue/yellow flower design big mug,37489B,1.95,United Kingdom
green/blue flower design big mug,37489C,1.95,United Kingdom
pink  heart shape love bucket ,21564,2.95,United Kingdom
scandinavian paisley picnic bag,21932,2.95,United Kingdom
pink vintage paisley picnic bag,21933,2.95,United Kingdom
charlie and lola charlotte bag,21100,1.65,United Kingdom
yellow/pink flower design big mug,37489A,1.95,United Kingdom
red retrospot tea cup and saucer ,22072,3.75,United Kingdom
fairy cake notebook a5 size,84534B,0.85,United Kingdom
english rose notebook a7 size,84536A,0.42,United Kingdom
more butter metal sign ,21905,2.1,United Kingdom
home sweet home metal sign ,21164,2.95,United Kingdom
party bunting,47566,4.65,United Kingdom
strawberries  design flannel ,21945,0.85,United Kingdom
vintage cream dog food container,22844,8.5,Poland
doormat neighbourhood witch ,22414,7.95,United Kingdom
pharmacie first aid tin,21906,6.75,United Kingdom
natural slate chalkboard large ,22456,4.95,United Kingdom
metal sign his dinner is served,22116,2.95,United Kingdom
beaded pearl heart white large,85130A,1.65,United Kingdom
beaded crystal heart blue small,85129C,1.25,United Kingdom
set of salt and pepper toadstools,22892,1.25,France
ribbon reel polkadots ,22080,1.65,France
metal decoration naughty children ,22948,0.85,EIRE
christmas metal postcard with bells,22944,1.25,EIRE
"garland, magic garden 1.8m",22246,1.95,EIRE
folk art metal star t-light holder,35967,0.38,EIRE
pig keyring with light & sound ,22299,1.25,EIRE
hello sailor blue soap holder,84849A,1.69,EIRE
coffee mug blue paisley design,22304,2.55,EIRE
beware of the cat metal sign ,21165,1.69,EIRE
3d sheet of dog stickers,84559A,0.85,EIRE
3d sheet of cat stickers,84559B,0.85,EIRE
bathroom set love heart design,22137,2.95,United Kingdom
cinnamon scented votive candle,85230B,0.29,United Kingdom
jasmine votive candle,85230F,0.29,United Kingdom
silver mug bone china tree of life,22306,1.95,United Kingdom
woodland party bag + sticker set,22331,1.65,Germany
hot baths soap holder,84849D,1.69,Germany
12 red rose peg place settings,21446,1.25,United Kingdom
blue circles design monkey doll,84507C,2.55,United Kingdom
vintage photo album paris days,20910,6.35,United Kingdom
midnight glamour scarf knitting kit,82616C,2.95,United Kingdom
frappucino scarf knitting kit,82616B,2.95,United Kingdom
skull lunch box with cutlery ,21558,2.55,United Kingdom
money box biscuits design,22409,1.25,United Kingdom
blue leaves and beads phone charm,90128B,1.25,United Kingdom
black gemstone necklace 45cm,90196B,12.75,United Kingdom
vintage rose bead bracelet black,90198B,4.25,United Kingdom
blue/green shell necklace w pendant,90152B,5.95,United Kingdom
silver/natural shell necklace,90151,8.5,United Kingdom
blue polkadot purse ,20661,2.95,United Kingdom
blue polkadot luggage tag ,20652,1.25,United Kingdom
dairy maid stripe mug,21845,2.95,United Kingdom
magnets pack of 4 swallows,22398,1.25,United Kingdom
blue patch purse pink heart,20854,1.65,United Kingdom
blue round compact mirror,84877D,3.75,United Kingdom
tropical luggage tag,20657,1.25,United Kingdom
assorted monkey suction cup hook,47422,0.42,United Kingdom
assorted tutti frutti pen,21642,0.85,United Kingdom
red retrospot luggage tag,20658,1.25,United Kingdom
magnets pack of 4 retro photo,22396,1.25,United Kingdom
ass floral print spirit level ,47503H,1.95,United Kingdom
columbian candle round,72130,0.65,United Kingdom
fuschia flower purse with beads,47343A,1.49,United Kingdom
rose scent candle in jewelled box,72802A,4.25,United Kingdom
dog toy with pink crochet skirt,84581,3.75,United Kingdom
mouse toy with pink t-shirt,84580,3.75,United Kingdom
set/3 ocean scent candle jewel box,72807B,4.25,United Kingdom
ocean scent candle in jewelled box,72802B,4.25,United Kingdom
nurse's bag soft toy,21054,8.95,United Kingdom
bohemian collage stationery set,21991,2.95,United Kingdom
pink/white ribbed melamine jug,84562A,7.95,United Kingdom
red retrospot picnic bag,21936,2.95,United Kingdom
modern vintage cotton shopping bag,21040,2.55,United Kingdom
strawberry   picnic bag,21937,2.95,United Kingdom
pink dog bowl,22701,2.95,United Kingdom
glass jar kings choice,22359,2.95,United Kingdom
glass jar daisy fresh cotton wool,22361,2.95,United Kingdom
glass jar peacock bath salts,22362,2.95,United Kingdom
bathroom scales footprints in sand,82011C,3.75,United Kingdom
new baroque black photo album,84865,8.5,United Kingdom
scented velvet lounge candle ,21287,1.25,Italy
blue flock glass candleholder,79337,1.65,Italy
